Sheet: db_charactersounds
A1: character | B1: hurtsound | C1: guardhitsound | D1: holdsound | E1: throwsound | F1: thrownrecoversound | G1: breakawaysound | H1: thrownsound | I1: getupsound | J1: defeatsound | K1: bodydropsound | L1: bodybumpsound | M1: bodyslamsound | N1: healsound | O1: victorysound | P1: dashsound | Q1: stopdashsound
A2: Rose | B2: sounds/player/damage2.mp3 | D2: sounds/combat/grab.mp3 | E2: sounds/player/attack2.mp3 | G2: sounds/combat/slap.mp3 | H2: sounds/player/damage3.mp3 | I2: sounds/player/getup.mp3 | J2: sounds/player/defeat.mp3 | K2: sounds/combat/bodydrop.mp3 | L2: sounds/combat/bodybump.mp3 | M2: sounds/combat/bodyslam.mp3 | O2: sounds/player/victory.mp3 | P2: sounds/combat/dash.mp3 | Q2: sounds/combat/slide.mp3
A3: bandit-dagger | F3: sounds/combat/slide.mp3 | J3: sounds/man_light/damage2.mp3 | K3: sounds/combat/bodydrop.mp3 | L3: sounds/combat/bodybump.mp3 | M3: sounds/combat/bodyslam.mp3
A4: bandit-spear | F4: sounds/combat/slide.mp3 | J4: sounds/man_medium/damage2.mp3 | K4: sounds/combat/bodydrop.mp3 | L4: sounds/combat/bodybump.mp3 | M4: sounds/combat/bodyslam.mp3
A5: container-stool | J5: sounds/combat/containerbreak.mp3
A6: furniture-table | J6: sounds/combat/containerbreak.mp3
A7: container-crate-tall | J7: sounds/combat/containerbreak.mp3
A8: container-barrel | J8: sounds/combat/containerbreak.mp3
A9: container-barrel-infinite | J9: sounds/combat/containerbreak.mp3
A10: food-container | J10: sounds/combat/containerbreak.mp3
A11: food-fish | N11: sounds/combat/heal.mp3
A12: food-bigfish | N12: sounds/combat/heal.mp3
A13: bandit-axe | C13: sounds/combat/block.mp3 | D13: sounds/combat/grab.mp3 | F13: sounds/combat/slide.mp3 | J13: sounds/man_heavy/hit3.mp3 | K13: sounds/combat/bodydrop.mp3 | L13: sounds/combat/bodybump.mp3 | M13: sounds/combat/bodyslam.mp3
A14: thrown-axe | M14: sounds/combat/cutwall.mp3
A15: bandit-bow | F15: sounds/combat/slide.mp3 | J15: sounds/man_light/damage2.mp3 | K15: sounds/combat/bodydrop.mp3 | L15: sounds/combat/bodybump.mp3 | M15: sounds/combat/bodyslam.mp3
A16: bandit-arrow | M16: sounds/combat/arrowhit.mp3
A17: bandit-sling | F17: sounds/combat/slide.mp3 | J17: sounds/man_light/damage2.mp3 | K17: sounds/combat/bodydrop.mp3 | L17: sounds/combat/bodybump.mp3 | M17: sounds/combat/bodyslam.mp3
A18: thrown-stone | M18: sounds/object/stone.mp3
A19: bandit-cave-door | C19: sounds/combat/block.mp3 | J19: sounds/combat/containerbreak.mp3
A20: bandit-boss | J20: sounds/man_heavy/bossdeath.mp3 | K20: sounds/combat/bodydrop.mp3 | L20: sounds/combat/bodybump.mp3 | M20: sounds/combat/bodyslam.mp3
A21: projectile-dish | M21: sounds/combat/breakglass.mp3
A22: food-small | N22: sounds/combat/heal.mp3
A23: food-medium | N23: sounds/combat/heal.mp3

Sheet: db_vfx
A1: vfx | B1: asefile | C1: script | D1: initialai | E1: asetag | F1: loopframe | G1: spriteoriginx | H1: spriteoriginy | I1: lifetime | J1: velz | K1: speed | L1: conearc | M1: gravity | N1: color
A2: spark-hit | B2: sprites/vfx.jase | C2: Dragontail.Character.Common | D2: spark | E2: hit | F2: 0 | G2: 109 | H2: 59 | I2: 6
A3: spark-guard | B3: sprites/vfx.jase | C3: Dragontail.Character.Common | D3: spark | E3: guard | F3: 0 | G3: 106 | H3: 34 | I3: 9
A4: spark-bighit | B4: sprites/vfx.jase | C4: Dragontail.Character.Common | D4: spark | E4: bighit | F4: 0 | G4: 98 | H4: 58 | I4: 9
A5: spark-fall-down-dust | B5: sprites/vfx/dust-on-person-fall.jase | C5: Dragontail.Character.Common | D5: spark | E5: Complete | F5: 0 | G5: 32 | H5: 24 | I5: 24 | J5: 0.5
A6: spark-stone-shatter | B6: sprites/weapons/stone.jase | C6: Dragontail.Character.Common | D6: spark | E6: Shatter | F6: 0 | G6: 8 | H6: 8 | I6: 12
A7: particle-blood | B7: sprites/vfx.jase | C7: Dragontail.Character.Common | D7: shrinkOut | E7: liquid | G7: 3 | H7: 3 | I7: 30 | K7: 3 | L7: of:=PI()/8 -> 0.392699081698724 | M7: 0.125 | N7: of:=ORG.LIBREOFFICE.COLOR(192;0;0; 255) -> 4290772992
A8: particle-hit-sweat | B8: sprites/vfx.jase | C8: Dragontail.Character.Common | D8: shrinkOut | E8: liquid | G8: 3 | H8: 3 | I8: 6 | K8: 4 | L8: of:=PI()/3 -> 1.0471975511966

Sheet: db_ui
A1: type | B1: asefile | C1: asetag | D1: spriteoriginx | E1: spriteoriginy | F1: drawz
A2: go-word | B2: sprites/ui/go-word.jase | D2: 16 | E2: 8 | F2: 100
A3: go-wings | B3: sprites/ui/go-wings.jase | D3: 16 | E3: 32 | F3: 99
A4: rose-crosshair | B4: sprites/ui/rose-crosshair.jase | C4: lockon | D4: 24 | E4: 24 | F4: 101

Sheet: db_characters
A1: character | B1: team | C1: health | D1: bodyradius | E1: bodyheight | F1: bodysolid | G1: canbeattacked | H1: canbedamagedbyattack | I1: canbegrabbed | J1: speed | K1: gravity | L1: dodgespeed | M1: dodgedecel | N1: approachtime | O1: defaultattack | P1: attackchoices | Q1: projectilelaunchheight | R1: aiafterthrown | S1: thrownrecovertime | T1: healhealth | U1: giveweapon | V1: asetag | W1: animationdirections | X1: script | Y1: initialai | Z1: holdai | AA1: hurtai | AB1: guardhitai | AC1: guardtime | AD1: aiafterhurt | AE1: guardcounterattack | AF1: guardhitstocounterattack | AG1: stunai | AH1: timetobreakhold | AI1: thrownai | AJ1: knockedbackspeed | AK1: knockedbacktime | AL1: thrownspeed | AM1: wallslamdamage | AN1: wallslamcounterattack | AO1: thrownrecoveranimation | AP1: fallanimationtime | AQ1: getuptime | AR1: defeatai | AS1: recoverai | AT1: aiaftergetup | AU1: aiafterbreakaway | AV1: attackafterbreakaway | AW1: itemtype
A2: Rose | B2: player | C2: 100 | D2: 16 | E2: 32 | G2: true | K2: 0.5 | Q2: 24 | R2: fall | W2: 8 | X2: Dragontail.Character.Player | Y2: control | Z2: hold | AA2: hurt | AD2: control | AM2: 10 | AO2: FallRiseToFeet | AP2: 20 | AQ2: 18 | AR2: defeat | AS2: control
A3: bandit-dagger | B3: enemy | C3: 50 | D3: 16 | E3: 32 | G3: true | I3: TRUE | J3: 3 | K3: 0.5 | O3: dagger-swing | R3: fall | S3: 24 | W3: 4 | X3: Dragontail.Character.Enemy | Y3: stand | AA3: hurt | AG3: stun | AH3: 120 | AI3: thrown | AL3: 10 | AO3: FallKnees | AP3: 20 | AQ3: 18 | AR3: defeat | AS3: stand | AU3: approach
A4: bandit-spear | B4: enemy | C4: 75 | D4: 16 | E4: 32 | G4: true | I4: TRUE | J4: 4 | K4: 0.5 | L4: 8 | M4: 0.25 | O4: spear-thrust | R4: fall | S4: 24 | W4: 4 | X4: Dragontail.Character.Enemy | Y4: stand | AA4: hurt | AG4: stun | AH4: 120 | AI4: thrown | AL4: 10 | AO4: FallKnees | AP4: 20 | AQ4: 18 | AR4: defeat | AS4: stand | AU4: approach
A5: container-stool | B5: container | C5: 10 | D5: 16 | E5: 12 | F5: TRUE | G5: true | I5: TRUE | K5: 0.5 | X5: Dragontail.Character.Fighter | Y5: containerIdle | AA5: hurt | AP5: 1 | AQ5: 0 | AR5: containerBreak | AS5: containerIdle
A6: furniture-table | B6: container | C6: 20 | D6: 16 | E6: 16 | F6: TRUE | G6: true | K6: 0.5 | X6: Dragontail.Character.Fighter | Y6: furnitureIdle | AA6: hurt | AP6: 1 | AQ6: 0 | AR6: containerBreak | AS6: furnitureIdle
A7: container-crate-tall | B7: container | C7: 15 | D7: 16 | E7: 30 | F7: TRUE | G7: true | I7: TRUE | K7: 0.5 | X7: Dragontail.Character.Fighter | Y7: containerIdle | AA7: hurt | AP7: 1 | AQ7: 0 | AR7: containerBreak | AS7: containerIdle
A8: container-barrel | B8: container | C8: 15 | D8: 12 | E8: 24 | F8: TRUE | G8: true | I8: TRUE | K8: 0.5 | X8: Dragontail.Character.Fighter | Y8: containerIdle | AA8: hurt | AP8: 1 | AQ8: 0 | AR8: containerBreak | AS8: containerIdle
A9: container-barrel-infinite | B9: container | C9: 15 | D9: 12 | E9: 24 | F9: TRUE | G9: true | I9: TRUE | K9: 0.5 | X9: Dragontail.Character.Fighter | Y9: containerIdle | AA9: hurt | AP9: 1 | AQ9: 0 | AR9: containerBreak | AS9: containerIdle | AW9: container-barrel-infinite
A10: food-container | B10: container | C10: 1 | D10: 16 | E10: 16 | F10: TRUE | G10: true | K10: 0.5 | V10: container | X10: Dragontail.Character.Common | AA10: containerBreak | AP10: 1 | AQ10: 0 | AR10: containerBreak
A11: food-fish | B11: item | D11: 18 | E11: 8 | K11: 0.25 | T11: 25 | V11: fish | X11: Dragontail.Character.Common | Y11: itemWaitForPickup
A12: food-bigfish | B12: item | D12: 18 | E12: 8 | K12: 0.25 | T12: 100 | V12: bigfish | X12: Dragontail.Character.Common | Y12: itemWaitForPickup
A13: item-throwing-axe | B13: item | D13: 18 | E13: 8 | K13: 0.25 | U13: thrown-axe | V13: throwing-axe | X13: Dragontail.Character.Common | Y13: itemWaitForPickup
A14: item-stone | B14: item | D14: 8 | E14: 8 | K14: 0.25 | U14: thrown-stone | V14: stone | X14: Dragontail.Character.Common | Y14: itemWaitForPickup
A15: bandit-axe | B15: enemy | C15: 150 | D15: 16 | E15: 32 | G15: true | I15: TRUE | J15: 3 | K15: 0.5 | N15: 30 | O15: axe-throw | P15: axe-swing axe-throw | Q15: 24 | R15: fall | S15: 18 | W15: 4 | X15: Dragontail.Character.Enemy | Y15: stand | AA15: hurt | AB15: guardHit | AC15: 30 | AE15: axe-swing-counter | AF15: 11 | AG15: stun | AH15: 60 | AI15: thrown | AJ15: 8 | AL15: 8 | AO15: FallKnees | AP15: 20 | AQ15: 18 | AR15: defeat | AS15: stand | AU15: attack
A16: thrown-axe | B16: enemy | C16: 1 | D16: 16 | E16: 16 | G16: true | I16: false | J16: 5 | K16: 0.25 | O16: thrown-axe-attack | P16: thrown-axe-attack thrown-axe-strong-attack | V16: thrownaxe0 | W16: 4 | X16: Dragontail.Character.Common | Y16: projectileFly | AA16: projectileDeflected | AI16: projectileFly | AL16: 10 | AW16: item-throwing-axe
A17: bandit-bow | B17: enemy | C17: 25 | D17: 16 | E17: 32 | G17: true | I17: TRUE | J17: 5 | K17: 0.5 | L17: 10 | M17: 0.25 | N17: 30 | O17: bow-shot | Q17: 24 | R17: fall | S17: 18 | W17: 4 | X17: Dragontail.Character.Enemy | Y17: stand | AA17: hurt | AG17: stun | AH17: 120 | AI17: thrown | AL17: 10 | AO17: FallKnees | AP17: 20 | AQ17: 18 | AR17: defeat | AS17: stand | AU17: attack | AV17: bow-shot
A18: bandit-arrow | B18: enemy | C18: 1 | D18: 2 | E18: 2 | G18: true | I18: false | J18: 15 | K18: 0.125 | O18: bandit-arrow-attack | W18: 4 | X18: Dragontail.Character.Common | Y18: projectileFly | AA18: projectileDeflected | AI18: projectileFly | AL18: 10
A19: bandit-sling | B19: enemy | C19: 15 | D19: 16 | E19: 32 | G19: true | I19: TRUE | J19: 5 | K19: 0.5 | N19: 30 | O19: sling-shot | Q19: 24 | R19: fall | S19: 18 | W19: 4 | X19: Dragontail.Character.Enemy | Y19: stand | AA19: hurt | AG19: stun | AH19: 120 | AI19: thrown | AL19: 10 | AO19: FallKnees | AP19: 20 | AQ19: 18 | AR19: defeat | AS19: stand | AU19: attack | AV19: bow-shot
A20: thrown-stone | B20: enemy | C20: 1 | D20: 4 | E20: 8 | G20: true | I20: false | J20: 10 | K20: 0.25 | O20: thrown-stone-attack | P20: thrown-stone-attack thrown-stone-strong-attack | W20: 1 | X20: Dragontail.Character.Common | Y20: projectileFly | AA20: projectileDeflected | AI20: projectileFly | AL20: 10 | AW20: item-stone
A21: bandit-cave-door | B21: enemy | C21: 1 | E21: 64 | F21: TRUE | G21: true | H21: ^human%-thrown$ | K21: 0.5 | V21: container | X21: Dragontail.Character.Common | Y21: furnitureIdle | AA21: containerBreak | AR21: containerBreak | AS21: furnitureIdle
A22: bandit-boss | B22: enemy | C22: 500 | D22: 16 | E22: 32 | G22: true | I22: TRUE | J22: 4 | K22: 0.5 | L22: 12 | M22: 0.5 | O22: bandit-boss-charge | R22: fall | S22: 24 | W22: 4 | X22: Dragontail.Character.Enemy.BanditBoss | Y22: stand | AA22: hurt | AG22: stun | AH22: 60 | AI22: thrown | AL22: 10 | AO22: FallKnees | AP22: 20 | AQ22: 15 | AR22: defeat | AS22: stand | AU22: approach
A23: item-dish | B23: item | D23: 12 | E23: 2 | K23: 0.25 | U23: projectile-dish | X23: Dragontail.Character.Common | Y23: itemWaitForPickup
A24: projectile-dish | B24: enemy | C24: 1 | D24: 12 | E24: 2 | G24: true | I24: false | J24: 12 | K24: 0.25 | O24: projectile-dish-attack | W24: 1 | X24: Dragontail.Character.Common | Y24: projectileFly | AA24: projectileDeflected | AI24: projectileFly | AL24: 10 | AW24: item-dish
A25: food-small | B25: item | D25: 8 | E25: 8 | K25: 0.25 | T25: 25 | V25: fish | X25: Dragontail.Character.Common | Y25: itemWaitForPickup
A26: food-medium | B26: item | D26: 8 | E26: 8 | K26: 0.25 | T26: 100 | V26: bigfish | X26: Dragontail.Character.Common | Y26: itemWaitForPickup

Sheet: db_charactersprites
A1: character | B1: asefile | C1: spriteoriginx | D1: spriteoriginy | E1: emoteasepritefile | F1: emoteoriginx | G1: emoteoriginy | H1: faceasepritefile | I1: shadowcolor | J1: weaponposasefile | K1: tileset | L1: tileid
A2: Rose | B2: sprites/rose.jase | C2: 32 | D2: 56 | E2: sprites/emotes.jase | F2: 12 | G2: 64 | H2: sprites/rose-face.jase | I2: of:=ORG.LIBREOFFICE.COLOR(0;0;0;255) -> 4278190080 | J2: sprites/rose-weapon-pos.jase
A3: bandit-dagger | B3: sprites/bandit/knife.jase | C3: 32 | D3: 56 | E3: sprites/emotes.jase | F3: 12 | G3: 56 | I3: of:=ORG.LIBREOFFICE.COLOR(0;0;0;255) -> 4278190080
A4: bandit-spear | B4: sprites/bandit/spear.jase | C4: 32 | D4: 56 | E4: sprites/emotes.jase | F4: 12 | G4: 56 | I4: of:=ORG.LIBREOFFICE.COLOR(0;0;0;255) -> 4278190080
A5: container-stool | I5: of:=ORG.LIBREOFFICE.COLOR(0;0;0;255) -> 4278190080
A6: furniture-table | I6: of:=ORG.LIBREOFFICE.COLOR(0;0;0;255) -> 4278190080
A7: container-crate-tall | I7: of:=ORG.LIBREOFFICE.COLOR(0;0;0;255) -> 4278190080
A8: container-barrel | I8: of:=ORG.LIBREOFFICE.COLOR(0;0;0;255) -> 4278190080
A9: container-barrel-infinite | I9: of:=ORG.LIBREOFFICE.COLOR(0;0;0;255) -> 4278190080 | K9: barrelA | L9: closed
A10: food-container | B10: sprites/food-container.jase | C10: 16 | D10: 24 | I10: of:=ORG.LIBREOFFICE.COLOR(0;0;0;255) -> 4278190080
A11: food-fish | B11: sprites/items.jase | C11: 32 | D11: 16 | I11: of:=ORG.LIBREOFFICE.COLOR(0;0;0;255) -> 4278190080
A12: food-bigfish | B12: sprites/items.jase | C12: 32 | D12: 16 | I12: of:=ORG.LIBREOFFICE.COLOR(0;0;0;255) -> 4278190080
A13: item-throwing-axe | B13: sprites/items.jase | C13: 32 | D13: 16 | I13: of:=ORG.LIBREOFFICE.COLOR(0;0;0;255) -> 4278190080
A14: item-stone | B14: sprites/items.jase | C14: 32 | D14: 16 | I14: of:=ORG.LIBREOFFICE.COLOR(0;0;0;255) -> 4278190080
A15: bandit-axe | B15: sprites/bandit/axe.jase | C15: 32 | D15: 56 | E15: sprites/emotes.jase | F15: 12 | G15: 64 | I15: of:=ORG.LIBREOFFICE.COLOR(0;0;0;255) -> 4278190080
A16: thrown-axe | B16: sprites/weapons/throwing-axe.jase | C16: 24 | D16: 24 | I16: of:=ORG.LIBREOFFICE.COLOR(0;0;0;255) -> 4278190080
A17: bandit-bow | B17: sprites/bandit/bow.jase | C17: 64 | D17: 88 | I17: of:=ORG.LIBREOFFICE.COLOR(0;0;0;255) -> 4278190080
A18: bandit-arrow | B18: sprites/bandit/arrow.jase | C18: 16 | D18: 16 | I18: of:=ORG.LIBREOFFICE.COLOR(0;0;0;255) -> 4278190080
A19: bandit-sling | B19: sprites/bandit/sling.jase | C19: 32 | D19: 56 | I19: of:=ORG.LIBREOFFICE.COLOR(0;0;0;255) -> 4278190080
A20: thrown-stone | B20: sprites/weapons/stone.jase | C20: 8 | D20: 8 | I20: of:=ORG.LIBREOFFICE.COLOR(0;0;0;255) -> 4278190080
A21: bandit-boss | B21: sprites/bandit/boss.jase | C21: 96 | D21: 120 | I21: of:=ORG.LIBREOFFICE.COLOR(0;0;0;255) -> 4278190080
A22: item-dish | I22: of:=ORG.LIBREOFFICE.COLOR(0;0;0;255) -> 4278190080 | K22: Dishes A | L22: dish-small
A23: projectile-dish | I23: of:=ORG.LIBREOFFICE.COLOR(0;0;0;255) -> 4278190080 | K23: Dishes A | L23: dish-small
A24: bandit-cave-door | I24: 0

Sheet: db_attacks
A1: attacktype | B1: speed | C1: attackradius | D1: attackarc | E1: attackdamage | F1: attackstun | G1: attackstunself | H1: attackspinspeed | I1: attackdecel | J1: attackwindupinvuln | K1: attackwinduptime | L1: attackhittime | M1: attacklungespeed | N1: attacklungedecel | O1: attackafterhittime | P1: attackpushbackspeed | Q1: attacklaunchspeed | R1: attackhitanimation | S1: attackhitai | T1: attackhitopponentai | U1: attackhitboundaryai | V1: attackhiteffect | W1: attackdefeateffect | X1: windupanimation | Y1: windupanimationloopframe | Z1: swinganimation | AA1: swinganimationloopframe | AB1: windupsound | AC1: swingsound | AD1: hitsound | AE1: attackdefeatsound | AF1: attackprojectile | AG1: hitspark | AH1: guardhitspark | AI1: afterimageinterval | AJ1: attackhurtparticle
A2: kick | C2: 32 | D2: of:=PI()/8 -> 0.392699081698724 | E2: 10 | F2: 10 | G2: 5 | I2: 4 | L2: 9 | M2: 4 | P2: 4 | Q2: 10 | V2: nil | W2: knockedBack | Z2: fastkick | AC2: sounds/combat/swing1.mp3 | AD2: sounds/combat/hit1.mp3 | AF2: nil | AG2: spark-hit | AH2: spark-guard | AI2: nil | AJ2: nil
A3: tail-swing-cw | C3: 40 | D3: of:=PI()/6 -> 0.523598775598299 | E3: 30 | F3: 10 | G3: 5 | H3: of:=PI()/5 -> 0.628318530717959 | L3: 20 | M3: 6 | P3: 6 | Q3: 10 | V3: knockedBack | W3: knockedBack | Z3: attackA | AC3: sounds/combat/swing2.mp3 | AD3: sounds/combat/hit3.mp3 | AE3: sounds/combat/hit3.mp3 | AF3: nil | AG3: spark-hit | AH3: spark-guard | AI3: nil | AJ3: nil
A4: tail-swing-ccw | C4: 40 | D4: of:=PI()/6 -> 0.523598775598299 | E4: 30 | F4: 10 | G4: 5 | H4: -0.628318530717959 | L4: 20 | M4: 6 | P4: 6 | Q4: 10 | V4: knockedBack | W4: knockedBack | Z4: attackB | AC4: sounds/combat/swing2.mp3 | AD4: sounds/combat/hit3.mp3 | AE4: sounds/combat/hit3.mp3 | AF4: nil | AG4: spark-hit | AH4: spark-guard | AI4: nil | AJ4: nil
A5: spinning-throw | C5: 0 | D5: 0 | E5: 25 | F5: 0 | G5: 0 | H5: of:=PI()/8 -> 0.392699081698724 | M5: nil | P5: nil | Q5: 12 | V5: nil | W5: knockedBack | Z5: spinthrow | AB5: sounds/combat/swing3.mp3 | AC5: sounds/combat/swing2.mp3 | AF5: nil | AG5: spark-hit | AH5: spark-guard | AI5: nil | AJ5: nil
A6: human-in-spinning-throw | C6: 24 | D6: of:=PI()/2 -> 1.5707963267949 | E6: 10 | F6: 12 | G6: 3 | L6: 20 | V6: knockedBack | W6: knockedBack | AD6: sounds/combat/hit2.mp3 | AF6: nil | AG6: spark-hit | AH6: spark-guard | AI6: nil | AJ6: nil
A7: holding-knee | C7: 16 | D7: of:=PI()/12 -> 0.261799387799149 | E7: 10 | F7: 10 | G7: 5 | I7: 4 | L7: 6 | M7: 2 | P7: nil | Q7: 5 | V7: nil | W7: knockedBack | Z7: holdknee | AC7: sounds/combat/swing1.mp3 | AD7: sounds/combat/hit2.mp3 | AF7: nil | AG7: spark-hit | AH7: spark-guard | AI7: nil | AJ7: nil
A8: holding-kick | C8: 32 | D8: of:=PI()/12 -> 0.261799387799149 | E8: 30 | F8: 10 | G8: 5 | I8: 4 | L8: 9 | M8: nil | P8: nil | Q8: 12 | V8: thrown | W8: thrown | Z8: hardkick | AC8: sounds/combat/swing1.mp3 | AD8: sounds/combat/hit3.mp3 | AF8: nil | AG8: spark-hit | AH8: spark-guard | AI8: nil | AJ8: nil
A9: running-kick | C9: 32 | D9: of:=PI()/6 -> 0.523598775598299 | E9: 25 | F9: 10 | G9: 10 | I9: 64 | L9: 20 | M9: nil | P9: nil | Q9: 12 | V9: thrown | W9: thrown | Z9: hardkick | AC9: sounds/player/attack2.mp3 | AD9: sounds/combat/hit3.mp3 | AF9: nil | AG9: spark-hit | AH9: spark-guard | AI9: 3 | AJ9: nil
A10: running-elbow | C10: 20 | D10: of:=PI()/2 -> 1.5707963267949 | E10: 10 | F10: 12 | G10: 3 | I10: 2 | L10: 10 | M10: nil | P10: nil | Q10: 5 | V10: nil | W10: knockedBack | Z10: elbow | AC10: nil | AD10: sounds/combat/hit1.mp3 | AF10: nil | AG10: spark-hit | AH10: spark-guard | AI10: nil | AJ10: nil
A11: running-with-enemy | C11: 24 | D11: of:=PI()/2 -> 1.5707963267949 | E11: 10 | F11: 12 | G11: 3 | M11: nil | P11: nil | Q11: 10 | V11: knockedBack | W11: knockedBack | AC11: sounds/player/attack2.mp3 | AD11: sounds/combat/hit2.mp3 | AF11: nil | AG11: spark-hit | AH11: spark-guard | AI11: nil | AJ11: nil
A12: dagger-swing | C12: 32 | D12: 0.196349540849362 | E12: 10 | F12: 12 | M12: 5 | V12: nil | W12: nil | X12: SwingWindup | Z12: SwingAttack | AB12: sounds/man_light/attack1.mp3 | AC12: sounds/combat/swing1.mp3 | AD12: sounds/combat/cut.mp3 | AG12: nil | AH12: nil | AI12: nil | AJ12: particle-blood
A13: spear-thrust | C13: 48 | D13: 0 | E13: 10 | F13: 12 | K13: 30 | M13: 15 | N13: 0.25 | V13: knockedBack | W13: nil | X13: ThrustWindup | Z13: ThrustAttack | AB13: sounds/man_medium/attack1.mp3 | AC13: sounds/combat/swingblade.mp3 | AD13: sounds/combat/cut.mp3 | AG13: nil | AH13: nil | AI13: nil | AJ13: particle-blood
A14: human-thrown | C14: 24 | D14: of:=PI()/4 -> 0.785398163397448 | E14: 10 | F14: 12 | G14: 3 | V14: knockedBack | W14: knockedBack | AC14: sounds/combat/spin.mp3 | AD14: sounds/combat/hit2.mp3 | AG14: spark-hit | AH14: spark-guard | AI14: nil | AJ14: nil
A15: axe-swing | B15: 4 | C15: 40 | D15: of:=PI()/4 -> 0.785398163397448 | E15: 25 | F15: 20 | G15: 10 | J15: false | K15: 10 | M15: 8 | V15: thrown | W15: thrown | X15: SwingWindup | Z15: SwingAttack | AB15: sounds/man_heavy/lightattack3.mp3 | AC15: sounds/combat/swing3.mp3 | AD15: sounds/combat/cut2.mp3 | AF15: nil | AG15: nil | AH15: nil | AI15: nil | AJ15: particle-blood
A16: axe-swing-counter | B16: 4 | C16: 40 | D16: of:=PI()/4 -> 0.785398163397448 | E16: 25 | F16: 20 | G16: 10 | J16: true | K16: 10 | M16: 8 | V16: thrown | W16: thrown | X16: SwingWindup | Z16: SwingAttack | AB16: sounds/man_heavy/lightattack3.mp3 | AC16: sounds/combat/swing3.mp3 | AD16: sounds/combat/cut2.mp3 | AF16: nil | AG16: nil | AH16: nil | AI16: nil | AJ16: particle-blood
A17: axe-throw | B17: 3 | C17: 200 | D17: 0 | E17: 0 | F17: 0 | G17: 0 | J17: false | K17: 10 | M17: 5 | V17: nil | W17: nil | X17: throwA | Z17: throwB | AB17: sounds/man_heavy/attack4.mp3 | AC17: sounds/combat/swing3.mp3 | AF17: thrown-axe | AG17: nil | AH17: nil | AI17: nil | AJ17: nil
A18: thrown-axe-attack | B18: 5 | C18: 16 | D18: of:=PI()/2 -> 1.5707963267949 | E18: 25 | F18: 20 | G18: 10 | R18: thrownaxehit | S18: projectileEmbed | V18: knockedBack | W18: knockedBack | Z18: thrownaxe | AC18: sounds/combat/spin.mp3 | AD18: sounds/combat/cut2.mp3 | AG18: nil | AH18: nil | AI18: nil | AJ18: particle-blood
A19: thrown-axe-strong-attack | B19: 12 | C19: 16 | D19: of:=PI()/2 -> 1.5707963267949 | E19: 25 | F19: 20 | G19: 10 | R19: thrownaxehit | U19: projectileEmbed | V19: knockedBack | W19: knockedBack | Z19: thrownaxe | AC19: sounds/combat/spin.mp3 | AD19: sounds/combat/cut2.mp3 | AG19: nil | AH19: nil | AI19: nil | AJ19: particle-blood
A20: bow-shot | B20: 3 | C20: 300 | D20: 0 | E20: 0 | F20: 0 | G20: 0 | J20: false | K20: 30 | M20: 0 | V20: nil | W20: nil | X20: ShootWindup | Z20: ShootAttack | AB20: sounds/combat/bowdraw.mp3 | AC20: sounds/combat/arrowfly.mp3 | AF20: bandit-arrow | AG20: nil | AH20: nil | AI20: nil | AJ20: nil
A21: bandit-arrow-attack | C21: 20 | D21: 0 | E21: 25 | F21: 12 | Q21: 5 | S21: projectileEmbed | W21: knockedBack | Z21: Fly | AD21: sounds/combat/cut.mp3 | AG21: nil | AH21: nil | AI21: nil | AJ21: particle-blood
A22: sling-shot | B22: 3 | C22: 300 | D22: 0 | E22: 0 | F22: 0 | G22: 0 | J22: false | K22: 30 | M22: 0 | V22: nil | W22: nil | X22: ShootWindup | Z22: ShootAttack | AB22: sounds/combat/bowdraw.mp3 | AC22: sounds/combat/arrowfly.mp3 | AF22: thrown-stone | AG22: nil | AH22: nil | AI22: nil | AJ22: nil
A23: thrown-stone-attack | B23: 12 | C23: 8 | D23: of:=PI() -> 3.14159265358979 | E23: 10 | F23: 10 | Q23: 5 | S23: projectileBounce | W23: knockedBack | Z23: Fly | AD23: sounds/combat/hit1.mp3 | AG23: spark-hit | AH23: spark-guard | AI23: nil | AJ23: nil
A24: thrown-stone-strong-attack | B24: 16 | C24: 12 | D24: of:=PI() -> 3.14159265358979 | E24: 15 | F24: 10 | Q24: 12 | S24: disappear | V24: knockedBack | W24: knockedBack | Z24: Fly | AD24: sounds/combat/hit3.mp3 | AG24: spark-stone-shatter | AH24: spark-stone-shatter | AI24: nil | AJ24: nil
A25: bandit-boss-charge | C25: 64 | D25: of:=PI()/12 -> 0.261799387799149 | E25: 15 | F25: 20 | G25: 5 | H25: 0 | K25: 30 | L25: 30 | M25: 16 | N25: 0.25 | Q25: 10 | V25: knockedBack | W25: knockedBack | X25: Charge | Y25: 1 | Z25: Charge | AA25: 1 | AB25: sounds/man_heavy/heavyattack3.mp3 | AC25: sounds/combat/swingblade.mp3 | AD25: sounds/combat/cut2.mp3 | AF25: nil | AG25: spark-bighit | AH25: spark-guard | AI25: 3 | AJ25: particle-blood
A26: projectile-dish-attack | B26: 12 | C26: 8 | D26: of:=PI() -> 3.14159265358979 | E26: 10 | F26: 10 | Q26: 5 | S26: disappear | W26: knockedBack | Z26: Fly | AD26: sounds/combat/breakglass.mp3 | AG26: spark-hit | AH26: spark-guard | AI26: nil | AJ26: nil
A27: bandit-boss-spin-cw | C27: 64 | D27: of:=PI()/4 -> 0.785398163397448 | E27: 20 | F27: 20 | G27: 5 | H27: of:=PI()/5 -> 0.628318530717959 | K27: 15 | L27: 20 | M27: 10 | N27: 0.5 | O27: 0 | Q27: 5 | V27: knockedBack | W27: knockedBack | X27: LookRight | Z27: SpinCW | AB27: sounds/man_heavy/lightattack3.mp3 | AC27: sounds/combat/swing3.mp3 | AD27: sounds/combat/cut2.mp3 | AF27: nil | AG27: spark-hit | AH27: spark-guard | AI27: nil | AJ27: particle-blood
A28: bandit-boss-spin-ccw | C28: 64 | D28: of:=PI()/4 -> 0.785398163397448 | E28: 20 | F28: 20 | G28: 5 | H28: -0.628318530717959 | K28: 15 | L28: 20 | M28: 10 | N28: 0.5 | O28: 0 | Q28: 5 | V28: knockedBack | W28: knockedBack | X28: LookLeft | Z28: SpinCCW | AB28: sounds/man_heavy/lightattack3.mp3 | AC28: sounds/combat/swing3.mp3 | AD28: sounds/combat/cut2.mp3 | AF28: nil | AG28: spark-hit | AH28: spark-guard | AI28: nil | AJ28: particle-blood

Sheet: db_characterstates
A1: state | B1: action | C1: animation | D1: frame | E1: loop | F1: canbeattacked | G1: canbegrabbed | H1: bodysolid | I1: sound
A2: hurt | B2: hurt | C2: Hurt | E2: 0 | F2: false | G2: false
A3: held | B3: held | C3: Hurt | F3: true | G3: false | H3: false
A4: knockedBack | B4: knockedBack | C4: Hurt | F4: false | G4: false
A5: wallBump | B5: wallBump | C5: Hurt | F5: false | G5: false | I5: sounds/combat/bodybump.mp3
A6: thrown | B6: thrown | C6: spin | F6: false | G6: false
A7: wallSlammed | B7: wallSlammed | C7: Hurt | F7: false | G7: false | I7: sounds/combat/bodyslam.mp3
A8: thrownRecover | B8: thrownRecover | C8: FallKnees | E8: 0 | F8: false | G8: false | I8: sounds/combat/slide.mp3
A9: breakaway | B9: breakaway | F9: false | G9: false | I9: sounds/combat/slap.mp3
A10: fall | B10: fall | E10: 0 | F10: false | G10: false | H10: false
A11: defeat | B11: defeat | C11: Fall | E11: 0 | F11: false | G11: false
A12: getup | B12: getup | C12: FallRiseToFeet | E12: 0 | F12: false | G12: false
A13: stand | B13: stand | C13: Stand | F13: true | G13: true
A14: dodgeIncoming | B14: dodgeIncoming | C14: Walk | F14: true | G14: true
A15: approach | B15: approach | C15: Walk | F15: true | G15: true
A16: attack | B16: attack | F16: true | G16: true
A17: guard | B17: guard | C17: guard | F17: true | G17: true
A18: guardHit | B18: guardHit | C18: guard | F18: false | G18: false
A19: control | B19: control | F19: true | G19: true
A20: spinAttack | B20: spinAttack | F20: false | G20: false
A21: hold | B21: hold | F21: true | G21: true
A22: runWithEnemy | B22: runWithEnemy | F22: false | G22: false
A23: spinAndKickEnemy | B23: spinAndKickEnemy | F23: false | G23: false
A24: straightAttack | B24: straightAttack | F24: false | G24: false
A25: aimThrow | B25: aimThrow | F25: true | G25: true
A26: throwWeapon | B26: throwWeapon | C26: throw | F26: false | G26: false
A27: victory | B27: victory | C27: win | F27: false | G27: false
A28: spark | B28: spark
A29: afterimage | B29: afterimage
A30: blinkOut | B30: blinkOut
A31: containerBreak | B31: containerBreak | F31: false | G31: false | H31: false
A32: itemDrop | B32: itemDrop
A33: itemWaitForPickup | B33: itemWaitForPickup
A34: projectileFly | B34: projectileFly
A35: projectileDeflected | B35: projectileDeflected
A36: projectileEmbed | B36: projectileEmbed | F36: false | G36: false
A37: projectileBounce | B37: projectileBounce | F37: false | G37: false
A38: leave | B38: leave | C38: Walk | F38: true | G38: true
A39: enterShootLeave | B39: enterShootLeave | C39: Walk | F39: true | G39: true
A40: enterAndAmbush | B40: enterAndAmbush | F40: true | G40: true
A41: disappear | B41: disappear
A42: containerIdle | F42: true | G42: true | H42: true
A43: furnitureIdle | F43: true | H43: true
A44: shrinkOut | B44: shrinkOut