filename,notes,authors,licenses,urls
"body/bodies/muscular/walk/fur_copper.png","see details at https://opengameart.org/content/lpc-character-bases","bluecarrot16, JaidynReiman, Evert, TheraHedwig, MuffinElZangano, Durrani, Sander Frenken (castelonia), Benjamin K. Smith (BenCreating), Eliza Wyatt (ElizaWy), dalonedrau, Stephen Challener (Redshrike)","CC-BY-SA 3.0, GPL 3.0","https://opengameart.org/content/liberated-pixel-cup-lpc-base-assets-sprites-map-tiles, https://opengameart.org/content/lpc-barbarian-sprite-base, https://opengameart.org/content/lpc-muscular-swing-animation, https://opengameart.org/content/lpc-muscular-hurt-animation, https://opengameart.org/content/lpc-jump-expanded, https://opengameart.org/content/lpc-revised-character-basics, https://opengameart.org/content/lpc-be-seated, https://opengameart.org/content/lpc-jump-expanded, https://opengameart.org/content/lpc-character-bases, https://opengameart.org/content/lpc-male-jumping-animation-by-durrani"
"head/heads/human/male/walk/fur_copper.png","original head by Redshrike, tweaks by BenCreating, modular version by bluecarrot16","bluecarrot16, Benjamin K. Smith (BenCreating), Stephen Challener (Redshrike)","OGA-BY 3.0, CC-BY-SA 3.0, GPL 3.0","https://opengameart.org/content/liberated-pixel-cup-lpc-base-assets-sprites-map-tiles, https://opengameart.org/content/lpc-character-bases"
"eyes/human/adult/anger/walk/gray.png","original by Redshrike, mapped to all frames by Matthew Krohn & JaidynReiman","JaidynReiman, Matthew Krohn (makrohn), Stephen Challener (Redshrike)","OGA-BY 3.0, CC-BY-SA 3.0, GPL 3.0","https://opengameart.org/content/liberated-pixel-cup-lpc-base-assets-sprites-map-tiles"
"legs/pantaloons/muscular/walk/red.png","Original bases by Redshrike, thrust/shoot bases by Wulax, Original Pantaloons by Nila122, climb/jump/run/sit/emotes/revised combat by JaidynReiman","Nila122, JaidynReiman, Johannes Sjölund (wulax), Stephen Challener (Redshrike)","OGA-BY 3.0, GPL 2.0, GPL 3.0, CC-BY-SA 3.0","https://opengameart.org/content/lpc-pirates, https://opengameart.org/content/more-lpc-clothes-and-hair, https://opengameart.org/content/lpc-expanded-pants"
"feet/sandals/male/walk/brown.png","edited for v3 bases by bluecarrot16, Jump/Sit/Emote/Run/Revised Combat by JaidynReiman","Nila122, JaidynReiman, Matthew Krohn (makrohn), Johannes Sjölund (wulax)","OGA-BY 3.0, CC-BY-SA 3.0, GPL 2.0, GPL 3.0","https://opengameart.org/content/lpc-roman-armor, http://opengameart.org/content/lpc-clothing-updates, https://opengameart.org/content/lpc-expanded-socks-shoes"
"head/faces/male/anger/walk/fur_copper.png","Original by Redshrike, Expressions by ElizaWy, mapped to all frames by JaidynReiman","JaidynReiman, ElizaWy, Stephen Challener (Redshrike)","OGA-BY 3.0","https://github.com/ElizaWy/LPC/tree/main/Characters/Head, https://opengameart.org/content/ulpc-expanded-expressions"
"bauldron/male/walk/charcoal.png","","Nila122","GPL 2.0, GPL 3.0, OGA-BY 3.0, CC-BY-SA 3.0","https://opengameart.org/content/more-lpc-clothes-and-hair"
