Sheet: db_characters
A1: character | B1: team | C1: health | D1: bodyradius | E1: bodysolid | F1: canbegrabbed | G1: speed | H1: approachtime | I1: defaultattack | J1: attackchoices | K1: thrownrecoverai | L1: thrownrecovertime | M1: healhealth | N1: animation | O1: animationdirections | P1: script | Q1: initialai | R1: holdai | S1: hurtai | T1: guardhitai | U1: guardtime | V1: hurtrecoverai | W1: guardcounterattack | X1: guardhitstocounterattack | Y1: stunai | Z1: holdstun | AA1: thrownai | AB1: knockedspeed | AC1: wallslamdamage | AD1: wallslamcounterattack | AE1: thrownrecoveranimation | AF1: defeatai
A2: Rose | B2: player | C2: 100 | D2: 16 | E2: TRUE | K2: fall | O2: 8 | P2: Dragontail.Character.Player | Q2: control | R2: hold | S2: hurt | V2: control | AC2: 10 | AE2: getup | AF2: defeat
A3: bandit-dagger | B3: enemy | C3: 50 | D3: 16 | E3: TRUE | F3: TRUE | G3: 3 | I3: dagger-swing | K3: fall | L3: 24 | O3: 4 | P3: Dragontail.Character.Enemy | Q3: stand | S3: hurt | V3: stand | Y3: stun | Z3: 120 | AA3: thrown | AB3: 10 | AE3: collapseA | AF3: defeat
A4: bandit-spear | B4: enemy | C4: 75 | D4: 16 | E4: TRUE | F4: TRUE | G4: 4 | I4: spear-thrust | K4: fall | L4: 24 | O4: 4 | P4: Dragontail.Character.Enemy | Q4: stand | S4: hurt | V4: stand | Y4: stun | Z4: 120 | AA4: thrown | AB4: 10 | AE4: collapseA | AF4: defeat
A5: food-container | B5: container | C5: 1 | D5: 16 | E5: TRUE | N5: container | P5: Dragontail.Character.Common | Q5: containerWaitForBreak | S5: containerBreak | AF5: containerBreak
A6: food-fish | B6: item | D6: 18 | M6: 25 | N6: fish | P6: Dragontail.Character.Common | Q6: itemWaitForPickup
A7: food-bigfish | B7: item | D7: 18 | M7: 100 | N7: bigfish | P7: Dragontail.Character.Common | Q7: itemWaitForPickup
A8: bandit-axe | B8: enemy | C8: 150 | D8: 16 | E8: TRUE | F8: TRUE | G8: 3 | H8: 30 | I8: axe-throw | J8: axe-swing axe-throw | K8: fall | L8: 18 | O8: 4 | P8: Dragontail.Character.Enemy | Q8: stand | S8: hurt | T8: guardHit | U8: 30 | V8: guard | W8: axe-swing | X8: 11 | Y8: stun | Z8: 60 | AA8: thrown | AB8: 8 | AD8: axe-swing | AE8: collapseA | AF8: defeat
A9: thrown-axe | B9: enemy | C9: 1 | D9: 16 | E9: true | F9: false | G9: 10 | I9: thrown-axe-attack | N9: thrownaxe0 | O9: 4 | P9: Dragontail.Character.Common | Q9: projectileFly | S9: projectileDeflected | AA9: projectileFly | AB9: 10

Sheet: db_charactersounds
A1: character | B1: hurtsound | C1: guardhitsound | D1: holdsound | E1: throwsound | F1: thrownrecoversound | G1: stunsound | H1: defeatsound | I1: bodydropsound | J1: bodyslamsound | K1: healsound | L1: victorysound
A2: Rose | B2: sounds/player/damage2.mp3 | D2: sounds/combat/grab.mp3 | E2: sounds/player/attack2.mp3 | G2: sounds/player/damage3.mp3 | H2: sounds/player/defeat.mp3 | I2: sounds/combat/bodydrop.mp3 | J2: sounds/combat/bodyslam.mp3 | L2: sounds/player/victory.mp3
A3: bandit-dagger | F3: sounds/combat/slide.mp3 | G3: sounds/man_light/damage1.mp3 | H3: sounds/man_light/damage2.mp3 | I3: sounds/combat/bodydrop.mp3 | J3: sounds/combat/bodyslam.mp3
A4: bandit-spear | F4: sounds/combat/slide.mp3 | G4: sounds/man_medium/damage1.mp3 | H4: sounds/man_medium/damage2.mp3 | I4: sounds/combat/bodydrop.mp3 | J4: sounds/combat/bodyslam.mp3
A5: food-container | H5: sounds/combat/containerbreak.mp3
A6: food-fish | K6: sounds/combat/heal.mp3
A7: food-bigfish | K7: sounds/combat/heal.mp3
A8: bandit-axe | C8: sounds/combat/block.mp3 | D8: sounds/combat/grab.mp3 | F8: sounds/combat/slide.mp3 | H8: sounds/man_heavy/hit3.mp3 | I8: sounds/combat/bodydrop.mp3 | J8: sounds/combat/bodyslam.mp3
A9: thrown-axe | J9: sounds/combat/cutwall.mp3

Sheet: db_vfx
A1: vfx | B1: asepritefile | C1: script | D1: initialai | E1: animation | F1: animationend | G1: spriteoriginx | H1: spriteoriginy | I1: sparktime
A2: spark-hit | B2: sprites/vfx.jase | C2: Dragontail.Character.Common | D2: spark | E2: hit | F2: stop | G2: 108 | H2: 80 | I2: 6
A3: spark-guard | B3: sprites/vfx.jase | C3: Dragontail.Character.Common | D3: spark | E3: guard | F3: stop | G3: 106 | H3: 64 | I3: 9
A4: spark-bighit | B4: sprites/vfx.jase | C4: Dragontail.Character.Common | D4: spark | E4: bighit | F4: stop | G4: 98 | H4: 80 | I4: 9

Sheet: db_charactersprites
A1: character | B1: asepritefile | C1: spriteoriginx | D1: spriteoriginy | E1: emoteasepritefile | F1: emoteoriginx | G1: emoteoriginy | H1: faceasepritefile | I1: shadowtype
A2: Rose | B2: sprites/rose.jase | C2: 32 | D2: 56 | E2: sprites/emotes.jase | F2: 12 | G2: 64 | H2: sprites/rose-face.jase | I2: true
A3: bandit-dagger | B3: sprites/bandit-dagger.jase | C3: 32 | D3: 48 | E3: sprites/emotes.jase | F3: 12 | G3: 56 | I3: true
A4: bandit-spear | B4: sprites/bandit-spear.jase | C4: 48 | D4: 96 | E4: sprites/emotes.jase | F4: 12 | G4: 56 | I4: true
A5: food-container | B5: sprites/food-container.jase | C5: 16 | D5: 24 | I5: true
A6: food-fish | B6: sprites/food-container.jase | C6: 16 | D6: 16
A7: food-bigfish | B7: sprites/food-container.jase | C7: 16 | D7: 16
A8: bandit-axe | B8: sprites/bandit-axe.jase | C8: 32 | D8: 48 | E8: sprites/emotes.jase | F8: 12 | G8: 64 | I8: true
A9: thrown-axe | B9: sprites/bandit-axe.jase | C9: 32 | D9: 56 | I9: true

Sheet: db_attacks
A1: attacktype | B1: speed | C1: attackradius | D1: attackarc | E1: attackdamage | F1: attackstun | G1: attackstunself | H1: attackspinspeed | I1: attackdecel | J1: attackwindupinvuln | K1: attackwinduptime | L1: attackhittime | M1: attacklungespeed | N1: attackhitanimation | O1: attackhitai | P1: attackhiteffect | Q1: attackdefeateffect | R1: windupanimation | S1: swinganimation | T1: windupsound | U1: swingsound | V1: hitsound | W1: attackdefeatsound | X1: attackprojectile | Y1: hitspark | Z1: guardhitspark
A2: tail-swing-cw | C2: 32 | D2: 0.314159265358979 | E2: 25 | F2: 20 | G2: 10 | H2: of:=PI()/5 -> 0.628318530717959 | L2: 20 | P2: nil | Q2: thrown | S2: attackA | U2: sounds/combat/swing2.mp3 | V2: sounds/combat/hit1.mp3 | W2: sounds/combat/hit3.mp3 | X2: nil | Y2: spark-hit | Z2: spark-guard
A3: tail-swing-ccw | C3: 32 | D3: 0.314159265358979 | E3: 25 | F3: 20 | G3: 10 | H3: -0.628318530717959 | L3: 20 | P3: nil | Q3: thrown | S3: attackB | U3: sounds/combat/swing2.mp3 | V3: sounds/combat/hit1.mp3 | W3: sounds/combat/hit3.mp3 | X3: nil | Y3: spark-hit | Z3: spark-guard
A4: spinning-throw | C4: 32 | D4: 0.392699081698724 | E4: 10 | F4: 12 | G4: 3 | H4: of:=PI()/8 -> 0.392699081698724 | L4: 20 | P4: thrown | Q4: thrown | S4: spinthrow | T4: sounds/combat/swing3.mp3 | U4: sounds/combat/swing2.mp3 | V4: sounds/combat/hit2.mp3 | X4: nil | Y4: spark-hit | Z4: spark-guard
A5: kick | C5: 32 | D5: of:=PI()/12 -> 0.261799387799149 | E5: 25 | F5: 20 | G5: 10 | I5: 32 | L5: 10 | P5: thrown | Q5: thrown | S5: kick | U5: sounds/combat/swing1.mp3 | V5: sounds/combat/hit3.mp3 | X5: nil | Y5: spark-hit | Z5: spark-guard
A6: running-elbow | C6: 20 | D6: of:=PI()/2 -> 1.5707963267949 | E6: 10 | F6: 12 | G6: 3 | I6: 4 | L6: 10 | P6: nil | Q6: nil | S6: elbow | U6: nil | V6: sounds/combat/hit1.mp3 | X6: nil | Y6: spark-hit | Z6: spark-guard
A7: dagger-swing | C7: 32 | D7: 0.196349540849362 | E7: 10 | F7: 12 | M7: 5 | Q7: nil | R7: attackA | S7: attackB | T7: sounds/man_light/attack1.mp3 | U7: sounds/combat/swing1.mp3 | V7: sounds/combat/cut.mp3 | Y7: nil | Z7: nil
A8: spear-thrust | C8: 48 | D8: 0 | E8: 10 | F8: 12 | M8: 10 | Q8: nil | R8: attackA | S8: attackB | T8: sounds/man_medium/attack1.mp3 | U8: sounds/combat/swingblade.mp3 | V8: sounds/combat/cut.mp3 | Y8: nil | Z8: nil
A9: human-thrown | C9: 16 | D9: 0.785398163397448 | E9: 50 | F9: 12 | G9: 3 | P9: nil | Q9: thrown | U9: sounds/combat/spin.mp3 | V9: sounds/combat/hit2.mp3 | Y9: spark-hit | Z9: spark-guard
A10: axe-swing | B10: 4 | C10: 40 | D10: 0.785398163397448 | E10: 25 | F10: 20 | G10: 10 | J10: true | K10: 10 | M10: 8 | P10: thrown | Q10: nil | R10: swingA | S10: swingB | T10: sounds/man_heavy/lightattack3.mp3 | U10: sounds/combat/swing3.mp3 | V10: sounds/combat/cut2.mp3 | X10: nil | Y10: nil | Z10: nil
A11: axe-throw | B11: 3 | C11: 100 | D11: 0 | E11: 0 | F11: 0 | G11: 0 | J11: false | K11: 30 | M11: 5 | P11: nil | Q11: nil | R11: throwA | S11: throwB | T11: sounds/man_heavy/attack4.mp3 | U11: sounds/combat/swing3.mp3 | X11: thrown-axe | Y11: nil | Z11: nil
A12: thrown-axe-attack | C12: 16 | D12: of:=PI()/2 -> 1.5707963267949 | E12: 25 | F12: 20 | G12: 10 | N12: thrownaxehit | O12: projectileHit | S12: thrownaxe | U12: sounds/combat/spin.mp3 | V12: sounds/combat/cut2.mp3 | Y12: nil | Z12: nil