Sheet: attacks
A1: attacktype | B1: radius | C1: arc | D1: z | E1: height | F1: damage | G1: opponentstun | H1: selfstun | I1: spinspeed | J1: attackwindupinvuln | K1: hittingduration | L1: launchspeed | M1: pushbackspeed | N1: opponentstateonhit | O1: opponentstateonfinalhit | P1: selfstateonhit | Q1: hitsound | R1: projectiletype | S1: hitspark | T1: guardhitspark | U1: hurtparticle | V1: canjuggle | W1: hurtcolorcycle | X1: deflectsprojectileatopponent | Y1: hitslayers
A2: dagger-swing | B2: 32 | C2: 0.196349540849362 | D2: 8 | E2: 8 | F2: 10 | G2: 12 | H2: 3 | K2: 6 | L2: 5 | M2: 5 | O2: knockedBack | Q2: data/sounds/combat/cut.mp3 | U2: particle-blood | W2: false | X2: false | Y2: Object Player
A3: spear-thrust | B3: 40 | C3: of:=PI()/16 -> 0.196349540849362 | D3: 8 | E3: 8 | F3: 10 | G3: 15 | H3: 3 | K3: 30 | L3: 10 | M3: 10 | N3: knockedBack | O3: knockedBack | Q3: data/sounds/combat/cut.mp3 | U3: particle-blood | W3: false | X3: false | Y3: Object Player
A4: spear-poke | B4: 40 | C4: of:=PI()/16 -> 0.196349540849362 | D4: 8 | E4: 8 | F4: 10 | G4: 15 | H4: 3 | K4: 12 | L4: 5 | M4: 5 | O4: knockedBack | Q4: data/sounds/combat/cut.mp3 | U4: particle-blood | W4: false | X4: false | Y4: Object Player
A5: human-thrown | B5: 24 | C5: of:=PI()/4 -> 0.785398163397448 | F5: 10 | G5: 12 | H5: 3 | L5: 5 | M5: 5 | N5: knockedBack | O5: knockedBack | Q5: data/sounds/combat/hit2.mp3 | S5: spark-hit | T5: spark-guard | W5: false | X5: false | Y5: Object Player Enemy
A6: axe-swing | B6: 40 | C6: of:=PI()/4 -> 0.785398163397448 | D6: 8 | E6: 8 | F6: 25 | G6: 20 | H6: 10 | J6: false | K6: 8 | L6: 10 | M6: 10 | N6: thrown | O6: thrown | Q6: data/sounds/combat/cut2.mp3 | U6: particle-blood | W6: false | X6: false | Y6: Object Player
A7: axe-swing-counter | B7: 40 | C7: of:=PI()/4 -> 0.785398163397448 | D7: 8 | E7: 8 | F7: 25 | G7: 20 | H7: 10 | J7: true | K7: 8 | L7: 10 | M7: 10 | N7: thrown | O7: thrown | Q7: data/sounds/combat/cut2.mp3 | U7: particle-blood | W7: false | X7: false | Y7: Object Player
A8: axe-throw | B8: 200 | C8: 0 | D8: 8 | E8: 8 | F8: 0 | G8: 0 | H8: 0 | J8: false | L8: 5 | M8: 0 | O8: knockedBack | R8: thrown-axe | W8: false | X8: false | Y8: Object Player
A9: bow-shot | B9: 300 | C9: 0 | D9: 8 | E9: 8 | F9: 0 | G9: 0 | H9: 0 | J9: false | L9: 5 | M9: 0 | O9: knockedBack | R9: bandit-arrow | W9: false | X9: false | Y9: Object Player
A10: sling-shot | B10: 300 | C10: 0 | D10: 8 | E10: 8 | F10: 0 | G10: 0 | H10: 0 | J10: false | L10: 5 | M10: 0 | O10: knockedBack | R10: thrown-stone | W10: false | X10: false | Y10: Object Player
A11: bandit-boss-charge | B11: 64 | C11: of:=PI()/12 -> 0.261799387799149 | D11: 12 | E11: 1 | F11: 15 | G11: 20 | H11: 5 | I11: 0 | K11: 30 | L11: 10 | M11: 10 | N11: knockedBack | O11: knockedBack | Q11: data/sounds/combat/cut2.mp3 | S11: spark-bighit | T11: spark-guard | U11: particle-blood | W11: false | X11: false | Y11: Object Player Enemy Projectile
A12: bandit-boss-poke | B12: 64 | C12: of:=PI()/12 -> 0.261799387799149 | D12: 12 | E12: 1 | F12: 15 | G12: 20 | H12: 5 | I12: 0 | K12: 9 | L12: 5 | M12: 10 | O12: knockedBack | Q12: data/sounds/combat/cut.mp3 | S12: spark-hit | T12: spark-guard | U12: particle-blood | W12: false | X12: false | Y12: Object Player Enemy Projectile
A13: bandit-boss-spin-cw | B13: 64 | C13: of:=PI()/4 -> 0.785398163397448 | D13: 4 | E13: 24 | F13: 20 | G13: 20 | H13: 5 | I13: of:=PI()/5 -> 0.628318530717959 | K13: 20 | L13: 5 | M13: 5 | N13: knockedBack | O13: knockedBack | Q13: data/sounds/combat/cut2.mp3 | S13: spark-hit | T13: spark-guard | U13: particle-blood | W13: false | X13: false | Y13: Object Player Enemy Projectile
A14: bandit-boss-spin-ccw | B14: 64 | C14: of:=PI()/4 -> 0.785398163397448 | D14: 4 | E14: 24 | F14: 20 | G14: 20 | H14: 5 | I14: -0.628318530717959 | K14: 20 | L14: 5 | M14: 5 | N14: knockedBack | O14: knockedBack | Q14: data/sounds/combat/cut2.mp3 | S14: spark-hit | T14: spark-guard | U14: particle-blood | W14: false | X14: false | Y14: Object Player Enemy Projectile
A15: bandit-boss-swat-projectile-cw | B15: 64 | C15: of:=PI()/3 -> 1.0471975511966 | D15: 4 | E15: 24 | F15: 20 | G15: 20 | H15: 5 | I15: of:=PI()/5 -> 0.628318530717959 | K15: 20 | L15: 5 | M15: 5 | N15: knockedBack | O15: knockedBack | Q15: data/sounds/combat/cut2.mp3 | S15: spark-hit | T15: spark-guard | U15: particle-blood | W15: false | X15: false | Y15: Object Player Enemy Projectile
A16: bandit-boss-swat-projectile-ccw | B16: 64 | C16: of:=PI()/3 -> 1.0471975511966 | D16: 4 | E16: 24 | F16: 20 | G16: 20 | H16: 5 | I16: -0.628318530717959 | K16: 20 | L16: 5 | M16: 5 | N16: knockedBack | O16: knockedBack | Q16: data/sounds/combat/cut2.mp3 | S16: spark-hit | T16: spark-guard | U16: particle-blood | W16: false | X16: false | Y16: Object Player Enemy Projectile
A17: forge-fire | B17: 36 | C17: of:=PI()/2 -> 1.5707963267949 | F17: 25 | G17: 20 | H17: 3 | L17: 5 | M17: 5 | N17: knockedBackBurntJuggled | O17: knockedBackBurntJuggled | Q17: data/sounds/combat/firehit.mp3 | S17: spark-hit | V17: true | W17: 4294904836 4294946828 | X17: false | Y17: Object Player Enemy
A18: human-in-spinning-throw | B18: 24 | C18: of:=PI()/2 -> 1.5707963267949 | F18: 10 | G18: 12 | H18: 0 | K18: 20 | L18: 5 | M18: 5 | N18: knockedBack | O18: knockedBack | Q18: data/sounds/combat/hit2.mp3 | S18: spark-hit | T18: spark-guard | W18: false | X18: false | Y18: Object Player Enemy
A19: human-in-flaming-spinning-throw | B19: 32 | C19: of:=PI()/2 -> 1.5707963267949 | F19: 10 | G19: 6 | H19: 0 | K19: 20 | L19: 5 | M19: 10 | N19: knockedBack | O19: knockedBack | Q19: data/sounds/combat/firehit.mp3 | S19: spark-hit | T19: spark-guard | W19: 4294904836 4294946828 | X19: false | Y19: Object Player Enemy
A20: shield-bash | B20: 24 | C20: of:=PI()/4 -> 0.785398163397448 | D20: 8 | E20: 8 | F20: 5 | G20: 12 | H20: 3 | K20: 9 | L20: 10 | M20: 10 | N20: thrown | O20: thrown | Q20: data/sounds/combat/hit3.mp3 | S20: spark-hit | T20: spark-guard | W20: false | X20: false | Y20: Object Player
A21: muscle-grab | B21: 24 | C21: of:=PI()/4 -> 0.785398163397448 | D21: 8 | E21: 8 | F21: 0 | G21: 0 | H21: 0 | K21: 30 | N21: held | O21: held | P21: grab | Q21: data/sounds/combat/grab.mp3 | X21: false | Y21: Object Player Enemy
A22: muscle-throw | B22: 0 | C22: 0 | D22: 0 | E22: 0 | F22: 5 | G22: 12 | H22: 3 | K22: 9 | L22: 10 | M22: 10 | N22: thrown | O22: thrown | Q22: data/sounds/combat/hit3.mp3 | S22: spark-hit | T22: spark-guard | W22: false | X22: false | Y22: Object Player Enemy

Sheet: states
A1: state | B1: statetime | C1: nextstate | D1: attack | E1: statebehavior | F1: statecoroutine | G1: statefunction | H1: animation | I1: loopframe | J1: canbeattacked | K1: canbegrabbed | L1: canbejuggled | M1: color | N1: sound | O1: voice | P1: afterimageinterval | Q1: faceturnspeed | R1: moveturnspeed | S1: speed | T1: accel | U1: bodyheight | V1: bodyhitslayers | W1: guardai | X1: maxtargetdist | Y1: gravity | Z1: z | AA1: velz
A2: dagger-swing | B2: 20 | C2: dagger-swing2 | D2: dagger-swing | E2: Dragontail.Character.Behavior.Enemy.AttackPrepare | H2: SwingWindup | I2: 0 | J2: true | K2: true | L2: false | N2: data/sounds/man_light/attack1.mp3 | P2: 0 | Q2: 0 | R2: 0 | S2: 5 | T2: 1 | X2: 47
A3: dagger-swing2 | B3: 40 | C3: stand | D3: dagger-swing | E3: Dragontail.Character.Behavior.Enemy.AttackExecute | H3: SwingAttack | I3: 0 | J3: true | K3: true | L3: false | N3: data/sounds/combat/swing1.mp3 | P3: 0 | Q3: 0 | R3: 0 | S3: 5 | T3: 1
A4: spear-thrust | B4: 30 | C4: spear-thrust2 | D4: spear-thrust | E4: Dragontail.Character.Behavior.Enemy.AttackPrepare | H4: ThrustWindup | I4: 0 | J4: true | K4: true | L4: false | N4: data/sounds/man_medium/attack1.mp3 | P4: 0 | Q4: 0 | R4: 0 | S4: 15 | T4: 1 | X4: 156.25
A5: spear-thrust2 | B5: 40 | C5: stand | D5: spear-thrust | E5: Dragontail.Character.Behavior.Enemy.AttackExecute | H5: ThrustAttack | I5: 0 | J5: true | K5: true | L5: false | N5: data/sounds/combat/swingblade.mp3 | P5: 3 | Q5: 0 | R5: 0 | S5: 15 | T5: 0.5
A6: spear-poke | B6: 20 | C6: spear-poke2 | D6: spear-poke | E6: Dragontail.Character.Behavior.Enemy.AttackPrepare | H6: ThrustWindup | I6: 0 | J6: true | K6: true | L6: false | N6: data/sounds/man_medium/attack1.mp3 | P6: 0 | Q6: of:=PI()/30 -> 0.10471975511966 | R6: 0 | S6: 10 | T6: 1 | X6: 92.5
A7: spear-poke2 | B7: 40 | C7: stand | D7: spear-poke | E7: Dragontail.Character.Behavior.Enemy.AttackExecute | H7: ThrustAttack | I7: 0 | J7: true | K7: true | L7: false | N7: data/sounds/combat/swing1.mp3 | P7: 0 | Q7: 0 | R7: 0 | S7: 10 | T7: 1
A8: axe-swing | B8: 10 | C8: axe-swing2 | D8: axe-swing | E8: Dragontail.Character.Behavior.Enemy.AttackPrepare | H8: SwingWindup | I8: 0 | J8: true | K8: true | L8: false | N8: data/sounds/man_heavy/lightattack3.mp3 | P8: 0 | Q8: 0 | R8: 0 | S8: 8 | T8: 1 | X8: 76
A9: axe-swing2 | B9: 40 | C9: stand | D9: axe-swing | E9: Dragontail.Character.Behavior.Enemy.AttackExecute | H9: SwingAttack | I9: 0 | J9: true | K9: true | L9: false | N9: data/sounds/combat/swing3.mp3 | P9: 0 | Q9: 0 | R9: 0 | S9: 8 | T9: 1
A10: axe-swing-counter | B10: 10 | C10: axe-swing-counter2 | D10: axe-swing-counter | E10: Dragontail.Character.Behavior.Enemy.AttackPrepare | H10: SwingWindup | I10: 0 | J10: false | K10: false | L10: false | N10: data/sounds/man_heavy/lightattack3.mp3 | P10: 0 | Q10: 0 | R10: 0 | S10: 8 | T10: 1 | X10: 76
A11: axe-swing-counter2 | B11: 40 | C11: stand | D11: axe-swing-counter | E11: Dragontail.Character.Behavior.Enemy.AttackExecute | H11: SwingAttack | I11: 0 | J11: false | K11: false | L11: false | N11: data/sounds/combat/swing3.mp3 | P11: 0 | Q11: 0 | R11: 0 | S11: 8 | T11: 1
A12: axe-throw | B12: 30 | C12: axe-throw2 | D12: axe-throw | E12: Dragontail.Character.Behavior.Enemy.AttackPrepare | H12: SwingWindup | I12: 0 | J12: true | K12: true | L12: false | N12: data/sounds/man_heavy/attack4.mp3 | P12: 0 | Q12: of:=PI() -> 3.14159265358979 | R12: 0 | S12: 0 | T12: 1 | X12: 200
A13: axe-throw2 | B13: 40 | C13: stand | D13: axe-throw | E13: Dragontail.Character.Behavior.Enemy.AttackExecute | H13: throwB | I13: 0 | J13: true | K13: true | L13: false | N13: data/sounds/combat/swing3.mp3 | P13: 0 | Q13: 0 | R13: 0 | S13: 0 | T13: 1
A14: axe-throw-until-empty | B14: 30 | C14: axe-throw-until-empty2 | D14: axe-throw | E14: Dragontail.Character.Behavior.Enemy.AttackPrepare | H14: SwingWindup | I14: 0 | J14: true | K14: true | L14: false | N14: data/sounds/man_heavy/attack4.mp3 | P14: 0 | Q14: of:=PI() -> 3.14159265358979 | R14: 0 | S14: 0 | T14: 1
A15: axe-throw-until-empty2 | B15: 40 | C15: attackIfAmmoElseLeave | D15: axe-throw | E15: Dragontail.Character.Behavior.Enemy.AttackExecute | H15: throwB | I15: 0 | J15: true | K15: true | L15: false | N15: data/sounds/combat/swing3.mp3 | P15: 0 | Q15: 0 | R15: 0 | S15: 0 | T15: 1
A16: bow-shot | B16: 90 | C16: bow-shot2 | D16: bow-shot | E16: Dragontail.Character.Behavior.Enemy.AttackPrepare | H16: ShootWindup | I16: 0 | J16: true | K16: true | L16: false | N16: data/sounds/combat/bowdraw.mp3 | P16: 0 | Q16: of:=PI() -> 3.14159265358979 | R16: 0 | S16: 0 | T16: 1 | X16: 300
A17: bow-shot2 | B17: 40 | C17: stand | D17: bow-shot | E17: Dragontail.Character.Behavior.Enemy.AttackExecute | H17: ShootAttack | I17: 0 | J17: true | K17: true | L17: false | N17: data/sounds/combat/arrowfly.mp3 | P17: 0 | Q17: 0 | R17: 0 | S17: 0 | T17: 1
A18: bow-shot-until-empty | B18: 90 | C18: bow-shot-until-empty2 | D18: bow-shot | E18: Dragontail.Character.Behavior.Enemy.AttackPrepare | H18: ShootWindup | I18: 0 | J18: true | K18: true | L18: false | N18: data/sounds/combat/bowdraw.mp3 | P18: 0 | Q18: of:=PI() -> 3.14159265358979 | R18: 0 | S18: 0 | T18: 1
A19: bow-shot-until-empty2 | B19: 40 | C19: attackIfAmmoElseLeave | D19: bow-shot | E19: Dragontail.Character.Behavior.Enemy.AttackExecute | H19: ShootAttack | I19: 0 | J19: true | K19: true | L19: false | N19: data/sounds/combat/arrowfly.mp3 | P19: 0 | Q19: 0 | R19: 0 | S19: 0 | T19: 1
A20: sling-shot | B20: 90 | C20: sling-shot2 | D20: sling-shot | E20: Dragontail.Character.Behavior.Enemy.AttackPrepare | H20: ShootWindup | I20: 0 | J20: true | K20: true | L20: false | N20: data/sounds/combat/bowdraw.mp3 | P20: 0 | Q20: of:=PI() -> 3.14159265358979 | R20: 0 | S20: 0 | T20: 1 | X20: 300
A21: sling-shot2 | B21: 40 | C21: stand | D21: sling-shot | E21: Dragontail.Character.Behavior.Enemy.AttackExecute | H21: ShootAttack | I21: 0 | J21: true | K21: true | L21: false | N21: data/sounds/combat/arrowfly.mp3 | P21: 0 | Q21: 0 | R21: 0 | S21: 0 | T21: 1
A22: sling-shot-until-empty | B22: 90 | C22: sling-shot-until-empty2 | D22: sling-shot | E22: Dragontail.Character.Behavior.Enemy.AttackPrepare | H22: ShootWindup | I22: 0 | J22: true | K22: true | L22: false | N22: data/sounds/combat/bowdraw.mp3 | P22: 0 | Q22: of:=PI() -> 3.14159265358979 | R22: 0 | S22: 0 | T22: 1
A23: sling-shot-until-empty2 | B23: 40 | C23: attackIfAmmoElseLeave | D23: sling-shot | E23: Dragontail.Character.Behavior.Enemy.AttackExecute | H23: ShootAttack | I23: 0 | J23: true | K23: true | L23: false | N23: data/sounds/combat/arrowfly.mp3 | P23: 0 | Q23: 0 | R23: 0 | S23: 0 | T23: 1
A24: shield-counter-bash | B24: 10 | C24: shield-counter-bash2 | D24: shield-bash | E24: Dragontail.Character.Behavior.Enemy.AttackPrepare | H24: SwingWindup | I24: 0 | J24: false | K24: false | L24: false | N24: data/sounds/man_medium/attack1.mp3 | P24: 0 | Q24: 0 | R24: 0 | S24: 10 | T24: 1
A25: shield-counter-bash2 | B25: 20 | C25: lowerGuard | D25: shield-bash | E25: Dragontail.Character.Behavior.Enemy.AttackExecute | H25: SwingAttack | I25: 0 | J25: false | K25: false | L25: false | N25: data/sounds/combat/swing1.mp3 | P25: 0 | Q25: 0 | R25: 0 | S25: 10 | T25: 1
A26: shield-bash | B26: 10 | C26: shield-bash2 | D26: shield-bash | E26: Dragontail.Character.Behavior.Enemy.AttackPrepare | H26: SwingWindup | I26: 0 | J26: true | K26: true | L26: false | N26: data/sounds/man_medium/attack1.mp3 | P26: 0 | Q26: 0 | R26: 0 | S26: 10 | T26: 1 | X26: 79
A27: shield-bash2 | B27: 20 | C27: lowerGuard | D27: shield-bash | E27: Dragontail.Character.Behavior.Enemy.AttackExecute | H27: SwingAttack | I27: 0 | J27: true | K27: true | L27: false | N27: data/sounds/combat/swing1.mp3 | P27: 0 | Q27: 0 | R27: 0 | S27: 10 | T27: 1
A28: muscle-grab | B28: 30 | C28: muscle-grab2 | D28: muscle-grab | E28: Dragontail.Character.Behavior.Enemy.AttackPrepare | H28: ReachWindup | I28: 0 | J28: true | K28: true | L28: true | N28: data/sounds/man_heavy/attack4.mp3 | P28: 0 | Q28: 0 | R28: 0 | S28: 8 | T28: 1 | W28: false | X28: 156
A29: muscle-grab2 | B29: 30 | C29: catchUnready | D29: muscle-grab | E29: Dragontail.Character.Behavior.Enemy.AttackExecute | H29: ReachWalk | I29: 1 | J29: true | K29: false | L29: true | O29: data/sounds/combat/runfast.mp3 | P29: 3 | Q29: of:=PI()/16 -> 0.196349540849362 | R29: of:=PI()/16 -> 0.196349540849362 | S29: 8 | T29: 0.25 | W29: catchAttack
A30: bandit-boss-first-charge | B30: 60 | C30: bandit-boss-charge2 | D30: bandit-boss-charge | E30: Dragontail.Character.Behavior.Enemy.AttackPrepare | H30: Charge | I30: 1 | J30: false | K30: false | L30: false | N30: data/sounds/man_heavy/heavyattack3.mp3 | P30: 0 | Q30: 0 | R30: 0 | S30: 16 | T30: 1
A31: bandit-boss-charge | B31: 30 | C31: bandit-boss-charge2 | D31: bandit-boss-charge | E31: Dragontail.Character.Behavior.Enemy.AttackPrepare | H31: Charge | I31: 1 | J31: true | K31: true | L31: false | N31: data/sounds/man_heavy/heavyattack3.mp3 | P31: 0 | Q31: 0 | R31: 0 | S31: 16 | T31: 1 | X31: 194
A32: bandit-boss-charge2 | B32: 40 | C32: stand | D32: bandit-boss-charge | E32: Dragontail.Character.Behavior.Enemy.AttackExecute | H32: Charge | I32: 1 | J32: true | K32: true | L32: false | N32: data/sounds/combat/swingblade.mp3 | P32: 3 | Q32: 0 | R32: 0 | S32: 16 | T32: 0.25
A33: bandit-boss-poke | B33: 6 | C33: bandit-boss-poke2 | D33: bandit-boss-poke | E33: Dragontail.Character.Behavior.Enemy.AttackPrepare | H33: ThrustWindup | I33: 0 | J33: true | K33: true | L33: false | N33: data/sounds/man_heavy/lightattack3.mp3 | P33: 0 | Q33: 0 | R33: 0 | S33: 8 | T33: 1 | X33: 98
A34: bandit-boss-poke2 | B34: 24 | C34: stand | D34: bandit-boss-poke | E34: Dragontail.Character.Behavior.Enemy.AttackExecute | H34: ThrustAttack | I34: 0 | J34: true | K34: true | L34: false | N34: data/sounds/combat/swing1.mp3 | P34: 0 | Q34: 0 | R34: 0 | S34: 8 | T34: 0.5
A35: bandit-boss-spin-cw | B35: 20 | C35: bandit-boss-spin-cw2 | D35: bandit-boss-spin-cw | E35: Dragontail.Character.Behavior.Enemy.AttackPrepare | H35: LookRight | I35: 0 | J35: true | K35: true | L35: false | N35: data/sounds/man_heavy/lightattack3.mp3 | P35: 0 | Q35: 0 | R35: 0 | S35: 10 | T35: 1 | X35: 116.5
A36: bandit-boss-spin-cw2 | B36: 20 | C36: stand | D36: bandit-boss-spin-cw | E36: Dragontail.Character.Behavior.Enemy.AttackExecute | H36: SpinCW | I36: 1 | J36: true | K36: true | L36: false | N36: data/sounds/combat/swing3.mp3 | P36: 0 | Q36: 0 | R36: 0 | S36: 10 | T36: 0.5
A37: bandit-boss-spin-ccw | B37: 20 | C37: bandit-boss-spin-ccw2 | D37: bandit-boss-spin-ccw | E37: Dragontail.Character.Behavior.Enemy.AttackPrepare | H37: LookLeft | I37: 0 | J37: true | K37: true | L37: false | N37: data/sounds/man_heavy/lightattack3.mp3 | P37: 0 | Q37: 0 | R37: 0 | S37: 10 | T37: 1 | X37: 116.5
A38: bandit-boss-spin-ccw2 | B38: 20 | C38: stand | D38: bandit-boss-spin-ccw | E38: Dragontail.Character.Behavior.Enemy.AttackExecute | H38: SpinCCW | I38: 1 | J38: true | K38: true | L38: false | N38: data/sounds/combat/swing3.mp3 | P38: 0 | Q38: 0 | R38: 0 | S38: 10 | T38: 0.5
A39: bandit-boss-swat-projectile-cw | B39: 15 | C39: stand | D39: bandit-boss-swat-projectile-cw | E39: Dragontail.Character.Behavior.Enemy.AttackExecute | H39: SpinCW | I39: 1 | J39: true | K39: true | L39: false | N39: data/sounds/combat/swing3.mp3 | P39: 0 | Q39: 0 | R39: 0 | S39: 0 | T39: 1 | X39: 64
A40: bandit-boss-swat-projectile-ccw | B40: 15 | C40: stand | D40: bandit-boss-swat-projectile-ccw | E40: Dragontail.Character.Behavior.Enemy.AttackExecute | H40: SpinCCW | I40: 1 | J40: true | K40: true | L40: false | N40: data/sounds/combat/swing3.mp3 | P40: 0 | Q40: 0 | R40: 0 | S40: 0 | T40: 1 | X40: 64
A41: bandit-boss-getup-spin-cw | B41: 18 | C41: bandit-boss-getup-spin-cw2 | D41: bandit-boss-spin-cw | E41: Dragontail.Character.Behavior.Enemy.AttackPrepare | H41: FallRiseToFeet | I41: 0 | J41: false | K41: false | L41: false | N41: data/sounds/man_heavy/lightattack3.mp3 | P41: 0 | Q41: 0 | R41: 0 | S41: 10 | T41: 1 | X41: 116.5
A42: bandit-boss-getup-spin-cw2 | B42: 20 | C42: stand | D42: bandit-boss-spin-ccw | E42: Dragontail.Character.Behavior.Enemy.AttackExecute | H42: SpinCCW | I42: 1 | J42: false | K42: false | L42: false | N42: data/sounds/combat/swing3.mp3 | P42: 0 | Q42: 0 | R42: 0 | S42: 10 | T42: 0.5
A43: bandit-boss-getup-spin-ccw | B43: 18 | C43: bandit-boss-getup-spin-ccw2 | D43: bandit-boss-spin-ccw | E43: Dragontail.Character.Behavior.Enemy.AttackPrepare | H43: FallRiseToFeet | I43: 0 | J43: false | K43: false | L43: false | N43: data/sounds/man_heavy/lightattack3.mp3 | P43: 0 | Q43: 0 | R43: 0 | S43: 10 | T43: 1 | X43: 116.5
A44: bandit-boss-getup-spin-ccw2 | B44: 20 | C44: stand | D44: bandit-boss-spin-ccw | E44: Dragontail.Character.Behavior.Enemy.AttackExecute | H44: SpinCCW | I44: 1 | J44: false | K44: false | L44: false | N44: data/sounds/combat/swing3.mp3 | P44: 0 | Q44: 0 | R44: 0 | S44: 10 | T44: 0.5
A45: human-in-spinning-throw | B45: false | C45: fall | D45: human-in-spinning-throw | F45: held | H45: Hurt | J45: false | K45: false | L45: false | P45: 0 | Q45: 0 | T45: 1
A46: human-in-flaming-spinning-throw | B46: false | C46: fall | D46: human-in-flaming-spinning-throw | F46: held | H46: Hurt | J46: false | K46: false | L46: false | P46: 0 | Q46: 0 | T46: 1
A47: forge-fire | B47: false | C47: false | D47: forge-fire | I47: 1 | J47: false | K47: false | L47: false | P47: 0 | Q47: 0 | T47: 1
A48: hurt | B48: false | C48: stand | E48: Dragontail.Character.Behavior.Enemy.GetHit | H48: Hurt | I48: 0 | J48: false | K48: false | L48: false | M48: of:=ORG.LIBREOFFICE.COLOR(255;255;255;255) -> 4294967295 | P48: 0 | Q48: 0 | T48: 1 | V48: Object Wall Camera
A49: grab | B49: 9 | C49: hold | E49: Dragontail.Character.Behavior.Fighter.Grabbing | H49: Grab | I49: 0 | J49: true | K49: true | L49: false | N49: data/sounds/combat/grab.mp3 | P49: 0 | Q49: of:=PI()/8 -> 0.392699081698724 | T49: 1 | V49: Object Wall Camera
A50: hold | B50: 30 | C50: throwOpponent | E50: Dragontail.Character.Behavior.Enemy.Hold | H50: Hold | I50: 0 | J50: true | K50: true | L50: false | P50: 0 | Q50: of:=PI()/8 -> 0.392699081698724 | T50: 1 | V50: Object Wall Camera
A51: throwOpponent | B51: 30 | C51: stand | D51: muscle-throw | E51: Dragontail.Character.Behavior.Enemy.ThrowOpponent | H51: SwingAttack | I51: 0 | J51: true | K51: true | L51: false | N51: data/sounds/man_heavy/lightattack3.mp3 | P51: 0 | Q51: 0 | R51: 0 | T51: 1
A52: held | B52: false | C52: stand | F52: held | H52: Hurt | J52: true | K52: false | L52: false | M52: of:=ORG.LIBREOFFICE.COLOR(255;255;255;255) -> 4294967295 | P52: 0 | Q52: 0 | T52: 1 | V52: Object Wall Camera
A53: knockedBack | B53: 300 | C53: fall | F53: knockedBack | H53: Hurt | J53: false | K53: false | L53: true | P53: 0 | Q53: 0 | T53: 1 | V53: Wall Camera
A54: knockedBackJuggled | B54: 300 | C54: fall | F54: knockedBack | H54: Hurt | J54: false | K54: false | L54: false | P54: 0 | Q54: 0 | T54: 1 | V54: Wall Camera
A55: knockedBackBurnt | B55: 300 | C55: fall | F55: knockedBack | H55: Hurt | J55: false | K55: false | L55: true | M55: of:=ORG.LIBREOFFICE.COLOR(32;32;32;255) -> 4280295456 | P55: 0 | Q55: 0 | T55: 1 | V55: Wall Camera
A56: knockedBackBurntJuggled | B56: 300 | C56: fall | F56: knockedBack | H56: Hurt | J56: false | K56: false | L56: false | M56: of:=ORG.LIBREOFFICE.COLOR(32;32;32;255) -> 4280295456 | P56: 0 | Q56: 0 | T56: 1 | V56: Wall Camera
A57: wallBump | B57: 300 | C57: fall | F57: wallBump | H57: Hurt | J57: false | K57: false | L57: false | N57: data/sounds/combat/bodybump.mp3 | P57: 0 | Q57: 0 | T57: 1
A58: thrown | B58: 300 | C58: fall | D58: human-thrown | F58: thrown | H58: spin | I58: 1 | J58: false | K58: false | L58: true | O58: data/sounds/combat/spin.mp3 | P58: 0 | Q58: 0 | T58: 1 | V58: Wall Camera
A59: wallSlammed | B59: 300 | C59: fall | F59: wallSlammed | H59: Hurt | J59: false | K59: false | L59: false | N59: data/sounds/combat/bodyslam.mp3 | P59: 0 | Q59: 0 | T59: 1
A60: thrownRecover | B60: false | C60: stand | F60: thrownRecover | H60: FallKnees | I60: 0 | J60: false | K60: false | L60: false | N60: data/sounds/combat/slide.mp3 | P60: 0 | Q60: 0 | T60: 1
A61: breakaway | B61: 15 | C61: .recoverai | F61: breakaway | H61: BreakHold | I61: 0 | J61: true | K61: true | L61: true | N61: data/sounds/combat/slap.mp3 | P61: 0 | Q61: 0 | T61: 1
A62: fall | B62: 300 | C62: collapse | G62: fall | I62: 0 | J62: false | K62: false | L62: false | P62: 0 | Q62: 0 | T62: 1
A63: collapse | B63: 15 | C63: down | G63: decelerateXYto0 | H63: Fall | I63: 0 | J63: false | K63: false | L63: false | P63: 0 | Q63: 0 | T63: 1
A64: down | B64: 20 | C64: getup | E64: Dragontail.Character.Behavior.Fighter.Downed | H64: Down | I64: 0 | J64: false | K64: false | L64: false | N64: data/sounds/combat/bodydrop.mp3 | P64: 0 | Q64: 0 | T64: 1
A65: defeat | B65: false | C65: false | F65: defeat | I65: 0 | J65: false | K65: false | L65: false | P65: 0 | Q65: 0 | T65: 1
A66: getup | B66: 18 | C66: .recoverai | F66: getup | H66: FallRiseToFeet | I66: 0 | J66: false | K66: false | L66: false | P66: 0 | Q66: 0 | T66: 1
A67: stand | B67: false | C67: false | F67: stand | H67: Stand | J67: true | K67: true | L67: false | P67: 0 | Q67: 0 | T67: 1
A68: dodgeIncoming | B68: false | C68: stand | E68: Dragontail.Character.Behavior.Fighter.DodgeLinear | H68: Walk | J68: true | K68: true | L68: false | P68: 0 | Q68: 0 | T68: 0.25
A69: approach | B69: 30 | C69: stand | E69: Dragontail.Character.Behavior.Enemy.Approach | H69: Walk | J69: true | K69: true | L69: false | P69: 0 | Q69: 0 | S69: .approachspeed | T69: 1
A70: raiseGuard | B70: 6 | C70: guard | E70: Dragontail.Character.Behavior.Enemy.Guard | H70: RaiseGuard | I70: 0 | J70: true | K70: true | L70: false | P70: 0 | Q70: 0 | T70: 0.25
A71: guard | B71: 54 | C71: lowerGuard | E71: Dragontail.Character.Behavior.Enemy.Guard | H71: Guard | I71: 0 | J71: true | K71: true | L71: false | P71: 0 | Q71: 0 | T71: 0.25
A72: guardHit | B72: 3 | C72: guard | E72: Dragontail.Character.Behavior.Enemy.GuardHit | H72: GuardHit | I72: 0 | J72: false | K72: true | L72: false | N72: data/sounds/combat/block.mp3 | P72: 0 | Q72: 0 | T72: 1
A73: lowerGuard | B73: 9 | C73: stand | H73: LowerGuard | I73: 0 | J73: true | K73: true | L73: false | P73: 0 | Q73: 0 | T73: 1
A74: leave | B74: false | C74: false | F74: leave | H74: Walk | J74: true | K74: true | L74: false | P74: 0 | Q74: 0 | S74: .approachspeed | T74: 1 | V74: Object Wall
A75: enterAndAttackUntilEmpty | B75: false | C75: attackIfAmmoElseLeave | F75: walkToEntryPoint | H75: Walk | J75: true | K75: true | L75: false | P75: 0 | Q75: 0 | T75: 1 | V75: Object Wall
A76: attackIfAmmoElseLeave | B76: false | C76: leave | F76: attackIfAmmoElseLeave | H76: Stand | J76: true | K76: true | L76: false | P76: 0 | Q76: 0 | T76: 1
A77: enterAndPrepareBowAmbush | B77: false | C77: prepareBowAmbush | F77: walkToEntryPoint | H77: Walk | J77: true | K77: true | L77: false | P77: 0 | Q77: 0 | T77: 1
A78: prepareBowAmbush | B78: 12 | C78: waitForBowAmbush | D78: bow-shot | E78: Dragontail.Character.Behavior.Enemy.AttackPrepare | H78: ShootWindup | I78: 0 | J78: true | K78: true | L78: false | N78: data/sounds/combat/bowdraw.mp3 | P78: 0 | Q78: 0 | T78: 1
A79: waitForBowAmbush | B79: false | C79: bow-shot-until-empty2 | F79: watchForOpponent | J79: true | K79: true | L79: false | P79: 0 | Q79: 0 | T79: 1
A80: blinkOut | B80: false | C80: false | F80: blinkOut | J80: false | K80: false | L80: false | P80: 0 | Q80: 0 | T80: 1
A81: disappear | B81: false | C81: false | F81: disappear | J81: false | K81: false | L81: false | P81: 0 | Q81: 0 | T81: 1
A82: catchProjectile | B82: 20 | C82: throwBackProjectile | E82: Dragontail.Character.Behavior.Fighter.CatchingProjectile | H82: catch | I82: 0 | J82: false | K82: false | L82: false | N82: data/sounds/man_heavy/amused2.mp3 | O82: data/sounds/combat/grab.mp3 | P82: 0 | Q82: 0 | T82: 1
A83: catchReady | B83: 60 | C83: catchUnready | E83: Dragontail.Character.Behavior.Enemy.Guard | H83: catchReady | I83: 0 | J83: true | K83: true | L83: false | N83: data/sounds/man_heavy/hut1.mp3 | P83: 0 | Q83: 0 | T83: 1 | W83: catchAttack
A84: catchUnready | B84: 9 | C84: .recoverai | H84: catchUnready | I84: 0 | J84: true | K84: true | L84: false | P84: 0 | Q84: 0 | T84: 1
A85: throwBackProjectile | B85: 15 | C85: throwBackProjectile2 | E85: Dragontail.Character.Behavior.Enemy.AttackPrepare | H85: SwingWindup | I85: 0 | J85: true | K85: true | L85: false | P85: 0 | Q85: of:=PI() -> 3.14159265358979 | T85: 1
A86: throwBackProjectile2 | B86: 40 | C86: .recoverai | E86: Dragontail.Character.Behavior.Enemy.AttackExecute | H86: SwingAttack | I86: 0 | J86: true | K86: true | L86: false | N86: data/sounds/combat/swing3.mp3 | P86: 0 | Q86: 0 | T86: 1
A87: crouch | B87: 30 | C87: crouchEnd | G87: decelerateXYto0 | H87: Crouch | I87: 0 | J87: true | K87: true | L87: false | P87: 0 | Q87: 0 | T87: 1 | U87: /=4
A88: crouchEnd | B88: 30 | C88: stand | G88: decelerateXYto0 | H88: CrouchEnd | I88: 0 | J88: true | K88: true | L88: false | P88: 0 | Q88: 0 | T88: 1 | U88: *=4
A89: guardForever | B89: 9999999 | C89: lowerGuard | E89: Dragontail.Character.Behavior.Enemy.Guard | H89: Guard | I89: 0 | J89: true | K89: true | L89: false | P89: 0 | Q89: 0 | T89: 1
A90: catchAttack | B90: 20 | E90: Dragontail.Character.Behavior.Enemy.CatchAttack | H90: catch | I90: 0 | J90: false | K90: false | L90: false | N90: data/sounds/man_heavy/amused2.mp3 | O90: data/sounds/combat/grab.mp3 | P90: 0 | Q90: of:=PI()/8 -> 0.392699081698724 | T90: 1
A91: bandit-boss-jump-for-spin-cw | B91: 15 | C91: bandit-boss-air-spin-cw | E91: Dragontail.Character.Behavior.Enemy.Jumping | H91: Jump | I91: 0 | J91: true | K91: true | L91: false | N91: data/sounds/man_heavy/hut1.mp3 | P91: 0 | Q91: 0 | S91: 0 | T91: 1 | X91: 64 | Y91: 0.25 | AA91: 4.5
A92: bandit-boss-air-spin-cw | B92: 20 | C92: bandit-boss-drop | D92: bandit-boss-spin-cw | E92: Dragontail.Character.Behavior.Enemy.AttackExecute | H92: AirSpinCW | I92: 1 | J92: true | K92: true | L92: false | N92: data/sounds/combat/swing3.mp3 | P92: 0 | Q92: 0 | R92: 0 | S92: 0 | T92: 1 | Y92: 0 | Z92: 40 | AA92: 0
A93: bandit-boss-jump-for-spin-ccw | B93: 15 | C93: bandit-boss-air-spin-ccw | E93: Dragontail.Character.Behavior.Enemy.Jumping | H93: Jump | I93: 0 | J93: true | K93: true | L93: false | N93: data/sounds/man_heavy/hut1.mp3 | P93: 0 | Q93: 0 | S93: 0 | T93: 1 | X93: 64 | Y93: 0.25 | AA93: 4.5
A94: bandit-boss-air-spin-ccw | B94: 20 | C94: bandit-boss-drop | D94: bandit-boss-spin-ccw | E94: Dragontail.Character.Behavior.Enemy.AttackExecute | H94: AirSpinCW | I94: 1 | J94: true | K94: true | L94: false | N94: data/sounds/combat/swing3.mp3 | P94: 0 | Q94: 0 | R94: 0 | S94: 0 | T94: 1 | Y94: 0 | Z94: 40 | AA94: 0
A95: bandit-boss-drop | B95: false | C95: stand | E95: Dragontail.Character.Behavior.Enemy.Jumping | H95: Jump | I95: 0 | J95: true | K95: true | L95: false | P95: 0 | Q95: 0 | T95: false | Y95: 0.5

Sheet: properties
A1: character | B1: team | C1: health | D1: bodyradius | E1: bodyheight | F1: bodyinlayers | G1: bodyhitslayers | H1: canbeattacked | I1: canbegrabbed | J1: speed | K1: approachspeed | L1: gravity | M1: dodgespeed | N1: dodgedecel | O1: defaultattack | P1: attackchoices | Q1: projectilelaunchheight | R1: aiafterthrown | S1: thrownrecovertime | T1: asetag | U1: animationdirections | V1: script | W1: statetable | X1: attacktable | Y1: initialai | Z1: hurtai | AA1: strugglestrength | AB1: initialholdstrength | AC1: thrownai | AD1: thrownrecoveranimation | AE1: defeatai | AF1: recoverai | AG1: attackafterbreakaway | AH1: guardarc | AI1: shadowcolor | AJ1: finalfallsound | AK1: defeatsound | AL1: weaponposasefile | AM1: guardai | AN1: escapeafterhits | AO1: escapestate | AP1: guardcounterstate | AQ1: numguardedhitsuntilcounter
A2: bandit-dagger | B2: enemies | C2: 25 | D2: 12 | E2: 32 | F2: Enemy | G2: Object Wall | H2: true | I2: TRUE | J2: 3 | K2: 3 | L2: 0.5 | O2: dagger-swing | R2: fall | S2: 24 | U2: 4 | V2: Dragontail.Character.Enemy | W2: data/database/bandits-states.csv | X2: data/database/bandits-attacks.csv | Y2: stand | Z2: hurt | AA2: 1 | AC2: thrown | AD2: FallKnees | AE2: defeat | AF2: stand | AI2: of:=ORG.LIBREOFFICE.COLOR(0;0;0;255) -> 4278190080 | AJ2: data/sounds/man_light/damage2.mp3
A3: bandit-spear | B3: enemies | C3: 35 | D3: 12 | E3: 32 | F3: Enemy | G3: Object Wall | H3: true | I3: TRUE | J3: 5 | K3: 5 | L3: 0.5 | M3: 7 | N3: 0.25 | O3: spear-thrust | R3: fall | S3: 24 | U3: 4 | V3: Dragontail.Character.Enemy.SpearBandit | W3: data/database/bandits-states.csv | X3: data/database/bandits-attacks.csv | Y3: stand | Z3: hurt | AA3: 1 | AC3: thrown | AD3: FallKnees | AE3: defeat | AF3: stand | AI3: of:=ORG.LIBREOFFICE.COLOR(0;0;0;255) -> 4278190080 | AJ3: data/sounds/man_medium/damage2.mp3
A4: bandit-axe | B4: enemies | C4: 100 | D4: 12 | E4: 32 | F4: Enemy | G4: Object Wall | H4: true | I4: TRUE | J4: 3 | K4: 3 | L4: 0.5 | O4: axe-throw | P4: axe-swing axe-throw | Q4: 24 | R4: fall | S4: 18 | U4: 4 | V4: Dragontail.Character.Enemy | W4: data/database/bandits-states.csv | X4: data/database/bandits-attacks.csv | Y4: stand | Z4: hurt | AA4: 2 | AC4: thrown | AD4: FallKnees | AE4: defeat | AF4: stand | AI4: of:=ORG.LIBREOFFICE.COLOR(0;0;0;255) -> 4278190080 | AJ4: data/sounds/man_heavy/hit3.mp3
A5: bandit-bow | B5: enemies | C5: 1 | D5: 12 | E5: 32 | F5: Enemy | G5: Object Wall | H5: true | I5: TRUE | J5: 5 | K5: 5 | L5: 0.5 | M5: 10 | N5: 0.25 | O5: bow-shot | Q5: 24 | R5: fall | S5: 18 | U5: 4 | V5: Dragontail.Character.Enemy | W5: data/database/bandits-states.csv | X5: data/database/bandits-attacks.csv | Y5: stand | Z5: hurt | AA5: 1 | AC5: thrown | AD5: FallKnees | AE5: defeat | AF5: stand | AG5: bow-shot | AI5: of:=ORG.LIBREOFFICE.COLOR(0;0;0;255) -> 4278190080 | AJ5: data/sounds/man_light/damage2.mp3
A6: bandit-sling | B6: enemies | C6: 1 | D6: 12 | E6: 32 | F6: Enemy | G6: Object Wall | H6: true | I6: TRUE | J6: 5 | K6: 5 | L6: 0.5 | O6: sling-shot | Q6: 24 | R6: fall | S6: 18 | U6: 4 | V6: Dragontail.Character.Enemy | W6: data/database/bandits-states.csv | X6: data/database/bandits-attacks.csv | Y6: stand | Z6: hurt | AA6: 1 | AC6: thrown | AD6: FallKnees | AE6: defeat | AF6: stand | AG6: bow-shot | AI6: of:=ORG.LIBREOFFICE.COLOR(0;0;0;255) -> 4278190080 | AJ6: data/sounds/man_light/damage2.mp3
A7: bandit-cave-door | B7: enemies | C7: 1 | E7: 64 | F7: Wall | T7: container | V7: Dragontail.Character.Common | W7: data/database/objects-states.csv | X7: data/database/objects-attacks.csv | Z7: containerBreak | AE7: containerBreak | AI7: 0 | AK7: data/sounds/combat/containerbreak.mp3
A8: bandit-boss | B8: enemies | C8: 400 | D8: 12 | E8: 32 | F8: Enemy | G8: Object Wall | H8: true | I8: TRUE | J8: 4 | K8: 4 | L8: 0.5 | M8: 8 | N8: 0.5 | O8: bandit-boss-charge | R8: fall | S8: 24 | U8: 4 | V8: Dragontail.Character.Enemy.BanditBoss | W8: data/database/bandits-states.csv | X8: data/database/bandits-attacks.csv | Y8: stand | Z8: hurt | AA8: 2 | AC8: thrown | AD8: FallKnees | AE8: defeat | AF8: stand | AI8: of:=ORG.LIBREOFFICE.COLOR(0;0;0;255) -> 4278190080 | AJ8: data/sounds/man_heavy/bossdeath.mp3
A9: bandit-shield | B9: enemies | C9: 40 | D9: 12 | E9: 32 | F9: Enemy | G9: Object Wall | H9: true | I9: TRUE | J9: 3 | K9: 3 | L9: 0.5 | M9: 5 | N9: 0.25 | O9: shield-bash | R9: fall | S9: 24 | U9: 4 | V9: Dragontail.Character.Enemy.ShieldBandit | W9: data/database/bandits-states.csv | X9: data/database/bandits-attacks.csv | Y9: stand | Z9: hurt | AA9: 1 | AC9: thrown | AD9: FallKnees | AE9: defeat | AF9: stand | AH9: of:=PI()/4 -> 0.785398163397448 | AI9: of:=ORG.LIBREOFFICE.COLOR(0;0;0;255) -> 4278190080 | AJ9: data/sounds/man_medium/damage2.mp3 | AM9: guardHit | AN9: 2 | AO9: guard | AP9: shield-counter-bash | AQ9: 4
A10: bandit-muscle | B10: enemies | C10: 75 | D10: 12 | E10: 32 | F10: Enemy | G10: Object Wall | H10: true | I10: TRUE | J10: 4 | K10: 4 | L10: 0.5 | O10: shield-bash | P10: muscle-grab shield-bash | Q10: 24 | R10: fall | S10: 18 | U10: 4 | V10: Dragontail.Character.Enemy.MuscleBandit | W10: data/database/bandits-states.csv | X10: data/database/bandits-attacks.csv | Y10: stand | Z10: hurt | AA10: 2 | AB10: 60 | AC10: thrown | AD10: FallKnees | AE10: defeat | AF10: stand | AH10: of:=PI()/3 -> 1.0471975511966 | AI10: of:=ORG.LIBREOFFICE.COLOR(0;0;0;255) -> 4278190080 | AJ10: data/sounds/man_heavy/hit3.mp3 | AL10: data/sprites/bandit/muscle-orange-weapon.jase | AM10: catchAttack | AN10: 2 | AO10: muscle-grab