Sheet: properties
A1: character | B1: team | C1: health | D1: bodyradius | E1: bodyheight | F1: bodyinlayers | G1: bodyhitslayers | H1: canbeattacked | I1: canbegrabbed | J1: gravity | K1: attackangle | L1: asetag | M1: script | N1: statetable | O1: attacktable | P1: initialai | Q1: hurtai | R1: fallanimationtime | S1: getuptime | T1: defeatai | U1: recoverai | V1: itemtype | W1: asefile | X1: shadowcolor | Y1: defeatsound
A2: container-chair | B2: container | C2: 10 | D2: 12 | E2: 24 | F2: Object | G2: Object Wall Camera | H2: true | I2: TRUE | J2: 0.5 | M2: Dragontail.Character.Fighter | N2: data/database/objects-states.csv | O2: data/database/objects-attacks.csv | P2: containerIdle | Q2: hurt | R2: 1 | S2: 0 | T2: containerBreak | U2: containerIdle | X2: of:=ORG.LIBREOFFICE.COLOR(0;0;0;255) -> 4278190080 | Y2: data/sounds/combat/containerbreak.mp3
A3: furniture-table | B3: container | C3: 20 | D3: 16 | E3: 16 | F3: Object | G3: Object Wall Camera | H3: true | J3: 0.5 | M3: Dragontail.Character.Fighter | N3: data/database/objects-states.csv | O3: data/database/objects-attacks.csv | P3: furnitureIdle | Q3: hurt | R3: 1 | S3: 0 | T3: containerBreak | U3: furnitureIdle | X3: of:=ORG.LIBREOFFICE.COLOR(0;0;0;255) -> 4278190080 | Y3: data/sounds/combat/containerbreak.mp3
A4: container-crate-tall | B4: container | C4: 15 | D4: 16 | E4: 30 | F4: Object | G4: Object Wall Camera | H4: true | I4: TRUE | J4: 0.5 | M4: Dragontail.Character.Fighter | N4: data/database/objects-states.csv | O4: data/database/objects-attacks.csv | P4: containerIdle | Q4: hurt | R4: 1 | S4: 0 | T4: containerBreak | U4: containerIdle | X4: of:=ORG.LIBREOFFICE.COLOR(0;0;0;255) -> 4278190080 | Y4: data/sounds/combat/containerbreak.mp3
A5: container-barrel | B5: container | C5: 15 | D5: 12 | E5: 24 | F5: Object | G5: Object Wall Camera | H5: true | I5: TRUE | J5: 0.5 | M5: Dragontail.Character.Fighter | N5: data/database/objects-states.csv | O5: data/database/objects-attacks.csv | P5: containerIdle | Q5: hurt | R5: 1 | S5: 0 | T5: containerBreak | U5: containerIdle | X5: of:=ORG.LIBREOFFICE.COLOR(0;0;0;255) -> 4278190080 | Y5: data/sounds/combat/containerbreak.mp3
A6: container-barrel-infinite | B6: container | C6: 15 | D6: 12 | E6: 24 | F6: Object | G6: Object Wall Camera | H6: true | I6: TRUE | J6: 0.5 | L6: closed | M6: Dragontail.Character.Fighter | N6: data/database/objects-states.csv | O6: data/database/objects-attacks.csv | P6: containerIdle | Q6: hurt | R6: 1 | S6: 0 | T6: containerBreak | U6: containerIdle | V6: container-barrel-infinite | W6: data/sprites/containers/barrelA.jase | X6: of:=ORG.LIBREOFFICE.COLOR(0;0;0;255) -> 4278190080 | Y6: data/sounds/combat/containerbreak.mp3
A7: food-container | B7: container | C7: 1 | D7: 16 | E7: 16 | F7: Object | G7: Object Wall Camera | H7: true | J7: 0.5 | L7: container | M7: Dragontail.Character.Common | N7: data/database/objects-states.csv | O7: data/database/objects-attacks.csv | Q7: containerBreak | R7: 1 | S7: 0 | T7: containerBreak | W7: data/sprites/containers/food-container.jase | X7: of:=ORG.LIBREOFFICE.COLOR(0;0;0;255) -> 4278190080 | Y7: data/sounds/combat/containerbreak.mp3
A8: forge-fire | D8: 32 | E8: 48 | F8: Object | G8: Object Wall Camera | K8: of:=PI()/2 -> 1.5707963267949 | N8: data/database/bandits-states.csv | O8: data/database/bandits-attacks.csv | P8: forge-fire

Sheet: attacks
A1: attacktype | B1: radius | C1: arc | D1: damage | E1: opponentstun | F1: selfstun | G1: hittingduration | H1: deflectsprojectile | I1: opponentstateonhit | J1: opponentstateonfinalhit | K1: swingsound | L1: hitsound | M1: hitspark | N1: guardhitspark | O1: hitslayers
A2: human-in-spinning-throw | B2: 24 | C2: of:=PI()/2 -> 1.5707963267949 | D2: 10 | E2: 12 | F2: 3 | G2: 20 | H2: true | I2: knockedBack | J2: knockedBack | L2: data/sounds/combat/hit2.mp3 | M2: spark-hit | N2: spark-guard | O2: Object Player Enemy
A3: human-thrown | B3: 24 | C3: of:=PI()/4 -> 0.785398163397448 | D3: 10 | E3: 12 | F3: 3 | I3: knockedBack | J3: knockedBack | K3: data/sounds/combat/spin.mp3 | L3: data/sounds/combat/hit2.mp3 | M3: spark-hit | N3: spark-guard | O3: Object Player Enemy

Sheet: states
A1: state | B1: attack | C1: action | D1: animation | E1: loopframe | F1: canbeattacked | G1: canbegrabbed | H1: canbejuggled | I1: bodyinlayers | J1: color | K1: sound
A2: hurt | C2: hurt | D2: Hurt | E2: 0 | F2: false | G2: false | H2: false | J2: of:=ORG.LIBREOFFICE.COLOR(255;255;255;255) -> 4294967295
A3: held | C3: held | D3: Hurt | F3: true | G3: false | H3: false | J3: of:=ORG.LIBREOFFICE.COLOR(255;255;255;255) -> 4294967295
A4: knockedBack | C4: knockedBack | D4: Hurt | F4: false | G4: false | H4: true
A5: knockedBackBurnt | C5: knockedBack | D5: Hurt | F5: false | G5: false | H5: true | J5: of:=ORG.LIBREOFFICE.COLOR(32;32;32;255) -> 4280295456
A6: knockedBackBurntJuggled | C6: knockedBack | D6: Hurt | F6: false | G6: false | H6: false | J6: of:=ORG.LIBREOFFICE.COLOR(32;32;32;255) -> 4280295456
A7: wallBump | C7: wallBump | D7: Hurt | F7: false | G7: false | H7: true | K7: data/sounds/combat/bodybump.mp3
A8: thrown | B8: human-thrown | C8: thrown | D8: spin | F8: false | G8: false | H8: true
A9: wallSlammed | C9: wallSlammed | D9: Hurt | F9: false | G9: false | H9: true | K9: data/sounds/combat/bodyslam.mp3
A10: fall | C10: fall | E10: 0 | F10: false | G10: false | H10: true | I10: 0
A11: down | C11: down | E11: 0 | F11: false | G11: false | H11: false | I11: 0 | K11: data/sounds/combat/bodydrop.mp3
A12: defeat | C12: defeat | D12: Fall | E12: 0 | F12: false | G12: false | H12: false
A13: getup | C13: getup | D13: FallRiseToFeet | E13: 0 | F13: false | G13: false | H13: false
A14: spark | C14: spark
A15: afterimage | C15: afterimage
A16: blinkOut | C16: blinkOut
A17: containerBreak | C17: containerBreak | F17: false | G17: false | I17: 0
A18: itemDrop | C18: itemDrop
A19: itemWaitForPickup | C19: itemWaitForPickup
A20: disappear | C20: disappear
A21: containerIdle | C21: containerIdle | F21: true | G21: true | I21: Object
A22: furnitureIdle | C22: furnitureIdle | F22: true | I22: Object
A23: shrinkOut | C23: shrinkOut
A24: guardHit | C24: guardHit | F24: false | G24: false | H24: false
A25: human-in-spinning-throw | B25: human-in-spinning-throw | C25: held | D25: Hurt | F25: false | G25: false | H25: false
A26: furnitureToBreak | C26: pulseRed | F26: true | I26: Object
A27: triggerToUse | C27: pulseAlpha