Sheet: attacks
A1: attacktype | B1: endscombo | C1: isholding | D1: radius | E1: arc | F1: z | G1: height | H1: damage | I1: opponentstun | J1: selfstun | K1: maxselfstuns | L1: faceangleoffset | M1: offsetfromfaceangle | N1: spinspeed | O1: minspin | P1: maxspin | Q1: hittingduration | R1: pushbackspeed | S1: launchspeed | T1: deflectsprojectile | U1: opponentstateonhit | V1: opponentstateonfinalhit | W1: windupsound | X1: hitsound | Y1: finalhitsound | Z1: hitspark | AA1: guardhitspark | AB1: hurtparticle | AC1: projectiletype | AD1: manacost | AE1: heldopponentstate | AF1: numprojectiles | AG1: hitslayers
A2: kick | B2: false | C2: false | D2: 40 | E2: of:=PI()/8 -> 0.392699081698724 | F2: 8 | G2: 16 | H2: 10 | I2: 15 | J2: 5 | K2: 1 | O2: false | P2: false | Q2: 9 | S2: 6 | T2: true | V2: knockedBack | X2: data/sounds/combat/hit1.mp3 | Z2: spark-hit | AA2: spark-guard | AB2: false | AC2: false | AD2: 0 | AE2: false | AF2: false | AG2: Object Enemy
A3: tail-swing-cw | B3: true | C3: false | D3: 48 | E3: of:=PI()/6 -> 0.523598775598299 | F3: 4 | G3: 24 | H3: 30 | I3: 10 | J3: 5 | M3: of:=PI() -> 3.14159265358979 | N3: of:=PI()/5 -> 0.628318530717959 | O3: false | P3: false | Q3: 20 | S3: 6 | T3: true | U3: knockedBack | V3: knockedBack | X3: data/sounds/combat/hit3.mp3 | Y3: data/sounds/combat/hit3.mp3 | Z3: spark-hit | AA3: spark-guard | AB3: false | AC3: false | AD3: 0 | AE3: false | AF3: false | AG3: Object Enemy
A4: tail-swing-ccw | B4: true | C4: false | D4: 48 | E4: of:=PI()/6 -> 0.523598775598299 | F4: 4 | G4: 24 | H4: 30 | I4: 10 | J4: 5 | M4: of:=PI() -> 3.14159265358979 | N4: -0.628318530717959 | O4: false | P4: false | Q4: 20 | S4: 6 | T4: true | U4: knockedBack | V4: knockedBack | X4: data/sounds/combat/hit3.mp3 | Y4: data/sounds/combat/hit3.mp3 | Z4: spark-hit | AA4: spark-guard | AB4: false | AC4: false | AD4: 0 | AE4: false | AF4: false | AG4: Object Enemy
A5: lunging-kick | B5: false | C5: false | D5: 40 | E5: of:=PI()/8 -> 0.392699081698724 | F5: 8 | G5: 16 | H5: 10 | I5: 15 | J5: 5 | K5: 1 | O5: false | P5: false | Q5: 9 | R5: attackerspeed | S5: 6 | T5: true | V5: knockedBack | X5: data/sounds/combat/hit1.mp3 | Z5: spark-hit | AA5: spark-guard | AB5: false | AC5: false | AD5: 0 | AE5: false | AF5: false | AG5: Object Enemy
A6: lunging-tail-swing-cw | B6: true | C6: false | D6: 48 | E6: of:=PI()/6 -> 0.523598775598299 | F6: 4 | G6: 24 | H6: 30 | I6: 10 | J6: 5 | M6: of:=PI() -> 3.14159265358979 | N6: of:=PI()/5 -> 0.628318530717959 | O6: false | P6: false | Q6: 20 | S6: 6 | T6: true | U6: knockedBack | V6: knockedBack | X6: data/sounds/combat/hit3.mp3 | Y6: data/sounds/combat/hit3.mp3 | Z6: spark-hit | AA6: spark-guard | AB6: false | AC6: false | AD6: 0 | AE6: false | AF6: false | AG6: Object Enemy
A7: lunging-tail-swing-ccw | B7: true | C7: false | D7: 48 | E7: of:=PI()/6 -> 0.523598775598299 | F7: 4 | G7: 24 | H7: 30 | I7: 10 | J7: 5 | M7: of:=PI() -> 3.14159265358979 | N7: -0.628318530717959 | O7: false | P7: false | Q7: 20 | S7: 6 | T7: true | U7: knockedBack | V7: knockedBack | X7: data/sounds/combat/hit3.mp3 | Y7: data/sounds/combat/hit3.mp3 | Z7: spark-hit | AA7: spark-guard | AB7: false | AC7: false | AD7: 0 | AE7: false | AF7: false | AG7: Object Enemy
A8: jump-tail-swing-cw | B8: true | C8: false | D8: 48 | E8: of:=PI()/8 -> 0.392699081698724 | F8: 0 | G8: 24 | H8: 20 | I8: 10 | J8: 5 | L8: of:=PI()/2 -> 1.5707963267949 | M8: of:=PI() -> 3.14159265358979 | N8: of:=PI()/10 -> 0.314159265358979 | O8: false | P8: false | Q8: 10 | S8: 6 | T8: true | U8: knockedBack | V8: knockedBack | X8: data/sounds/combat/hit3.mp3 | Y8: data/sounds/combat/hit3.mp3 | Z8: spark-hit | AA8: spark-guard | AB8: false | AC8: false | AD8: 0 | AE8: false | AF8: false | AG8: Object Enemy
A9: jump-tail-swing-ccw | B9: true | C9: false | D9: 48 | E9: of:=PI()/8 -> 0.392699081698724 | F9: 0 | G9: 24 | H9: 20 | I9: 10 | J9: 5 | L9: of:=-PI()/2 -> -1.5707963267949 | M9: of:=PI() -> 3.14159265358979 | N9: of:=-PI()/10 -> -0.314159265358979 | O9: false | P9: false | Q9: 10 | S9: 6 | T9: true | U9: knockedBack | V9: knockedBack | X9: data/sounds/combat/hit3.mp3 | Y9: data/sounds/combat/hit3.mp3 | Z9: spark-hit | AA9: spark-guard | AB9: false | AC9: false | AD9: 0 | AE9: false | AF9: false | AG9: Object Enemy
A10: spinning-throw | B10: true | C10: true | D10: 24 | E10: of:=PI()/2 -> 1.5707963267949 | H10: 10 | I10: 0 | J10: 0 | N10: of:=PI()/8 -> 0.392699081698724 | O10: false | P10: false | Q10: 20 | T10: true | U10: knockedBack | V10: knockedBack | W10: data/sounds/combat/swing3.mp3 | Z10: spark-hit | AA10: spark-guard | AB10: false | AC10: false | AD10: 0 | AE10: human-in-spinning-throw | AF10: false | AG10: Object Enemy
A11: flaming-spinning-throw | B11: true | C11: true | D11: 24 | E11: of:=PI()/2 -> 1.5707963267949 | H11: 10 | I11: 0 | J11: 0 | N11: of:=PI()/6 -> 0.523598775598299 | O11: of:=4*PI() -> 12.5663706143592 | P11: of:=8*PI() -> 25.1327412287183 | Q11: 20 | T11: true | U11: knockedBack | V11: knockedBack | W11: data/sounds/combat/ignite.mp3 | Z11: spark-hit | AA11: spark-guard | AB11: false | AC11: false | AD11: 120 | AE11: human-in-flaming-spinning-throw | AF11: false | AG11: Object Enemy
A12: holding-knee | B12: false | C12: true | D12: 32 | E12: of:=PI()/12 -> 0.261799387799149 | F12: 8 | G12: 16 | H12: 10 | I12: 10 | J12: 5 | O12: false | P12: false | Q12: 5 | S12: 5 | T12: true | V12: knockedBack | X12: data/sounds/combat/hit2.mp3 | Z12: spark-hit | AA12: spark-guard | AB12: false | AC12: false | AD12: 0 | AE12: false | AF12: false | AG12: Object Enemy
A13: holding-kick | B13: true | C13: true | D13: 32 | E13: of:=PI()/8 -> 0.392699081698724 | F13: 8 | G13: 16 | H13: 30 | I13: 10 | J13: 5 | O13: false | P13: false | Q13: 9 | S13: 12 | T13: true | U13: thrown | V13: thrown | X13: data/sounds/combat/hit3.mp3 | Z13: spark-hit | AA13: spark-guard | AB13: false | AC13: false | AD13: 0 | AE13: false | AF13: false | AG13: Object Enemy
A14: running-kick | B14: true | C14: false | D14: 32 | E14: of:=PI()/6 -> 0.523598775598299 | F14: 8 | G14: 16 | H14: 25 | I14: 10 | J14: 10 | O14: false | P14: false | Q14: 20 | S14: 12 | T14: true | U14: knockedBack | V14: knockedBack | X14: data/sounds/combat/hit3.mp3 | Z14: spark-hit | AA14: spark-guard | AB14: false | AC14: false | AD14: 0 | AE14: false | AF14: false | AG14: Object Enemy
A15: running-elbow | B15: true | C15: false | D15: 20 | E15: of:=PI()/8 -> 0.392699081698724 | F15: 8 | G15: 16 | H15: 10 | I15: 12 | J15: 5 | K15: 1 | O15: false | P15: false | Q15: 5 | S15: 5 | T15: true | V15: knockedBack | X15: data/sounds/combat/hit1.mp3 | Z15: spark-hit | AA15: spark-guard | AB15: false | AC15: false | AD15: 0 | AE15: false | AF15: false | AG15: Object Enemy
A16: running-with-enemy | B16: true | C16: false | D16: 24 | E16: of:=PI()/4 -> 0.785398163397448 | H16: 10 | I16: 12 | J16: 3 | O16: false | P16: false | S16: 10 | T16: true | U16: knockedBack | V16: knockedBack | X16: data/sounds/combat/hit2.mp3 | Z16: spark-hit | AA16: spark-guard | AB16: false | AC16: false | AD16: 0 | AE16: false | AF16: false | AG16: Object Enemy
A17: human-thrown | B17: true | C17: false | D17: 24 | E17: of:=PI()/4 -> 0.785398163397448 | H17: 10 | I17: 12 | J17: 3 | O17: false | P17: false | U17: knockedBack | V17: knockedBack | W17: data/sounds/combat/spin.mp3 | X17: data/sounds/combat/hit2.mp3 | Z17: spark-hit | AA17: spark-guard | AB17: false | AC17: false | AD17: 0 | AE17: false | AF17: false | AG17: Object Enemy Player
A18: spit-fireball | B18: true | C18: false | D18: 0 | E18: 0 | F18: 8 | G18: 16 | H18: 0 | I18: 0 | J18: 0 | N18: 0 | O18: false | P18: false | Q18: 20 | R18: 0 | S18: 0 | T18: false | U18: false | V18: false | Z18: spark-hit | AA18: spark-guard | AB18: false | AC18: Rose-fireball | AD18: 60 | AE18: false | AF18: 1 | AG18: Object Enemy
A19: spit-fat-fireball | B19: true | C19: false | D19: 0 | E19: 0 | F19: 8 | G19: 16 | H19: 0 | I19: 0 | J19: 0 | N19: 0 | O19: false | P19: false | Q19: 9 | R19: 0 | S19: 0 | T19: false | U19: false | V19: false | Z19: spark-hit | AA19: spark-guard | AB19: false | AC19: Rose-fat-fireball | AD19: 120 | AE19: false | AF19: 1 | AG19: Object Enemy
A20: running-spit-fireball | B20: true | C20: false | D20: 0 | E20: 0 | F20: 8 | G20: 16 | H20: 0 | I20: 0 | J20: 0 | N20: 0 | O20: false | P20: false | Q20: 20 | R20: 0 | S20: 0 | T20: false | U20: false | V20: false | Z20: spark-hit | AA20: spark-guard | AB20: false | AC20: Rose-fireball | AD20: 60 | AE20: false | AF20: 1 | AG20: Object Enemy
A21: running-spit-fat-fireball | B21: true | C21: false | D21: 0 | E21: 0 | F21: 8 | G21: 16 | H21: 0 | I21: 0 | J21: 0 | N21: 0 | O21: false | P21: false | Q21: 20 | R21: 0 | S21: 0 | T21: false | U21: false | V21: false | Z21: spark-hit | AA21: spark-guard | AB21: false | AC21: Rose-fat-fireball | AD21: 120 | AE21: false | AF21: 1 | AG21: Object Enemy
A22: fireball-spin-cw | B22: true | C22: false | D22: 0 | E22: 0 | F22: 8 | G22: 16 | H22: 0 | I22: 0 | J22: 0 | N22: of:=PI()/5 -> 0.628318530717959 | O22: false | P22: false | Q22: 20 | R22: 0 | S22: 0 | T22: false | U22: false | V22: false | Z22: spark-hit | AA22: spark-guard | AB22: false | AC22: Rose-fireball | AD22: 120 | AE22: false | AF22: 20 | AG22: Object Enemy
A23: fireball-spin-ccw | B23: true | C23: false | D23: 0 | E23: 0 | F23: 8 | G23: 16 | H23: 0 | I23: 0 | J23: 0 | N23: -0.628318530717959 | O23: false | P23: false | Q23: 20 | R23: 0 | S23: 0 | T23: false | U23: false | V23: false | Z23: spark-hit | AA23: spark-guard | AB23: false | AC23: Rose-fireball | AD23: 120 | AE23: false | AF23: 20 | AG23: Object Enemy
A24: fireball-storm | B24: true | C24: false | D24: 0 | E24: 0 | F24: 8 | G24: 16 | H24: 0 | I24: 0 | J24: 0 | N24: of:=PI()*3/16 -> 0.589048622548086 | O24: false | P24: false | Q24: 60 | R24: 0 | S24: 0 | T24: false | U24: false | V24: false | Z24: spark-hit | AA24: spark-guard | AB24: false | AC24: Rose-fireball | AD24: 180 | AE24: false | AF24: 60 | AG24: Object Enemy
A25: spit-multi-fireball | B25: true | C25: false | D25: 0 | E25: of:=PI()/4 -> 0.785398163397448 | F25: 8 | G25: 16 | H25: 0 | I25: 0 | J25: 0 | N25: 0 | O25: false | P25: false | Q25: 20 | R25: 0 | S25: 0 | T25: false | U25: false | V25: false | Z25: spark-hit | AA25: spark-guard | AB25: false | AC25: Rose-fireball | AD25: 120 | AE25: false | AF25: 5 | AG25: Object Enemy
A26: running-spit-multi-fireball | B26: true | C26: false | D26: 0 | E26: of:=PI()/4 -> 0.785398163397448 | F26: 8 | G26: 16 | H26: 0 | I26: 0 | J26: 0 | N26: 0 | O26: false | P26: false | Q26: 20 | R26: 0 | S26: 0 | T26: false | U26: false | V26: false | Z26: spark-hit | AA26: spark-guard | AB26: false | AC26: Rose-fireball | AD26: 120 | AE26: false | AF26: 5 | AG26: Object Enemy

Sheet: states
A1: state | B1: attack | C1: statebehavior | D1: statecoroutine | E1: statefunction | F1: nextstate | G1: statetime | H1: asefile | I1: animation | J1: loopframe | K1: canbeattacked | L1: canbegrabbed | M1: canbejuggled | N1: color | O1: sound | P1: afterimageinterval | Q1: manachargerate | R1: manadecayrate | S1: gravity | T1: mass | U1: speed | V1: faceturnspeed
A2: kick | B2: kick | C2: Dragontail.Character.Behavior.Player.AttackingStraight | F2: walk | G2: 12 | H2: .attackasefile | I2: fastkick | J2: 0 | K2: true | L2: true | M2: false | O2: data/sounds/combat/swing1.mp3 | P2: 0 | Q2: 0 | R2: 0 | T2: 1 | U2: 0 | V2: of:=PI() -> 3.14159265358979
A3: tail-swing-cw | B3: tail-swing-cw | C3: Dragontail.Character.Behavior.Player.SpinAttack | F3: walk | G3: false | H3: .attackasefile | I3: attackA | J3: 1 | K3: false | L3: false | M3: false | O3: data/sounds/combat/swing2.mp3 | P3: 0 | Q3: 0 | R3: 0 | T3: 1 | U3: 0 | V3: of:=PI()/5 -> 0.628318530717959
A4: tail-swing-ccw | B4: tail-swing-ccw | C4: Dragontail.Character.Behavior.Player.SpinAttack | F4: walk | G4: false | H4: .attackasefile | I4: attackB | J4: 1 | K4: false | L4: false | M4: false | O4: data/sounds/combat/swing2.mp3 | P4: 0 | Q4: 0 | R4: 0 | T4: 1 | U4: 0 | V4: of:=PI()/5 -> 0.628318530717959
A5: lunging-kick | B5: lunging-kick | C5: Dragontail.Character.Behavior.Player.AttackingStraight | F5: walk | G5: 12 | H5: .attackasefile | I5: fastkick | J5: 0 | K5: true | L5: true | M5: false | O5: data/sounds/combat/swing1.mp3 | P5: 0 | Q5: 0 | R5: 0 | T5: 4 | U5: 5 | V5: of:=PI() -> 3.14159265358979
A6: lunging-tail-swing-cw | B6: lunging-tail-swing-cw | C6: Dragontail.Character.Behavior.Player.SpinAttack | F6: walk | G6: false | H6: .attackasefile | I6: attackA | J6: 1 | K6: false | L6: false | M6: false | O6: data/sounds/combat/swing2.mp3 | P6: 0 | Q6: 0 | R6: 0 | T6: 4 | U6: 15 | V6: of:=PI()/5 -> 0.628318530717959
A7: lunging-tail-swing-ccw | B7: lunging-tail-swing-ccw | C7: Dragontail.Character.Behavior.Player.SpinAttack | F7: walk | G7: false | H7: .attackasefile | I7: attackB | J7: 1 | K7: false | L7: false | M7: false | O7: data/sounds/combat/swing2.mp3 | P7: 0 | Q7: 0 | R7: 0 | T7: 4 | U7: 15 | V7: of:=PI()/5 -> 0.628318530717959
A8: spinning-throw | B8: spinning-throw | C8: Dragontail.Character.Behavior.Player.SpinAndKickEnemy | F8: holding-kick | G8: false | H8: .holdasefile | I8: spinthrow | J8: 1 | K8: false | L8: false | M8: false | O8: data/sounds/combat/swing3.mp3 | P8: 0 | Q8: 0 | R8: 0 | T8: 2 | U8: 4 | V8: of:=PI()/8 -> 0.392699081698724
A9: flaming-spinning-throw | B9: flaming-spinning-throw | C9: Dragontail.Character.Behavior.Player.SpinAndKickEnemy | F9: holding-kick | G9: false | H9: .holdasefile | I9: spinthrow | J9: 1 | K9: false | L9: false | M9: false | O9: data/sounds/combat/swing3.mp3 | P9: 3 | Q9: 0 | R9: 0 | T9: 2 | U9: 4 | V9: of:=PI()/6 -> 0.523598775598299
A10: swingEnemyIntoWall | E10: decelerateXYto0 | F10: walk | G10: 6 | H10: .holdasefile | I10: holdknee | J10: 1 | K10: false | L10: false | M10: false | P10: 0 | Q10: 0 | R10: 0 | T10: 4 | U10: 4 | V10: 0
A11: holding-knee | B11: holding-knee | C11: Dragontail.Character.Behavior.Player.AttackingStraight | F11: walk | G11: 5 | H11: .holdasefile | I11: holdknee | J11: 0 | K11: true | L11: true | M11: false | O11: data/sounds/combat/swing1.mp3 | P11: 0 | Q11: 0 | R11: 0 | T11: 1 | U11: 0 | V11: of:=PI() -> 3.14159265358979
A12: holding-kick | B12: holding-kick | C12: Dragontail.Character.Behavior.Player.AttackingStraight | F12: walk | G12: 9 | H12: .attackasefile | I12: hardkick | J12: 1 | K12: false | L12: false | M12: false | O12: data/sounds/combat/swing1.mp3 | P12: 0 | Q12: 0 | R12: 0 | T12: 1 | U12: 0 | V12: of:=PI() -> 3.14159265358979
A13: running-kick | B13: running-kick | C13: Dragontail.Character.Behavior.Player.AttackingStraight | F13: running-kick-recover | G13: 20 | H13: .attackasefile | I13: hardkick | J13: 1 | K13: true | L13: true | M13: false | O13: data/sounds/player/attack2.mp3 | P13: 3 | Q13: 0 | R13: 0 | T13: 64 | U13: 8 | V13: of:=PI() -> 3.14159265358979
A14: running-kick-recover | E14: decelerateXYto0 | F14: walk | G14: 12 | H14: .attackasefile | I14: kickrecover | J14: 0 | K14: true | L14: true | M14: false | P14: 0 | Q14: 2 | R14: 2 | T14: 8 | U14: 4 | V14: 0
A15: running-elbow | B15: running-elbow | C15: Dragontail.Character.Behavior.Player.AttackingStraight | F15: walk | G15: 10 | H15: .mainasefile | I15: elbow | J15: 0 | K15: true | L15: true | M15: false | P15: 0 | Q15: 2 | R15: 2 | T15: 2 | U15: 4 | V15: of:=PI() -> 3.14159265358979
A16: runIntoWall | E16: decelerateXYto0 | F16: walk | G16: 15 | H16: .mainasefile | I16: elbow | J16: 0 | K16: true | L16: true | M16: false | O16: data/sounds/combat/bodyslam.mp3 | P16: 0 | Q16: 2 | R16: 2 | T16: 1 | U16: 4 | V16: 0
A17: running-with-enemy | B17: running-with-enemy | C17: Dragontail.Character.Behavior.Player.Running | F17: walk | G17: false | H17: .holdasefile | I17: holdwalk | J17: 1 | K17: false | L17: false | M17: false | O17: data/sounds/combat/dash.mp3 | P17: 3 | Q17: 2 | R17: 2 | T17: 16 | U17: 8 | V17: of:=PI()/32 -> 0.098174770424681
A18: spit-fireball | B18: spit-fireball | C18: Dragontail.Character.Behavior.Player.AttackingStraight | F18: walk | G18: 20 | H18: .attackasefile | I18: spit | J18: 0 | K18: false | L18: false | M18: false | P18: 0 | Q18: 0 | R18: 0 | T18: 4 | U18: -6 | V18: of:=PI() -> 3.14159265358979
A19: spit-fat-fireball | B19: spit-fat-fireball | C19: Dragontail.Character.Behavior.Player.AttackingStraight | F19: walk | G19: 9 | H19: .attackasefile | I19: spit | J19: 0 | K19: false | L19: false | M19: false | P19: 0 | Q19: 0 | R19: 0 | T19: 4 | U19: -6 | V19: of:=PI() -> 3.14159265358979
A20: running-spit-fireball | B20: running-spit-fireball | C20: Dragontail.Character.Behavior.Player.AttackingStraight | F20: walk | G20: 20 | H20: .attackasefile | I20: spit | J20: 0 | K20: false | L20: false | M20: false | P20: 0 | Q20: 0 | R20: 0 | T20: 8 | U20: 4 | V20: of:=PI() -> 3.14159265358979
A21: running-spit-fat-fireball | B21: running-spit-fat-fireball | C21: Dragontail.Character.Behavior.Player.AttackingStraight | F21: walk | G21: 20 | H21: .attackasefile | I21: spit | J21: 0 | K21: false | L21: false | M21: false | P21: 0 | Q21: 0 | R21: 0 | T21: 8 | U21: 4 | V21: of:=PI() -> 3.14159265358979
A22: spit-multi-fireball | B22: spit-multi-fireball | C22: Dragontail.Character.Behavior.Player.AttackingStraight | F22: walk | G22: 20 | H22: .attackasefile | I22: spit | J22: 0 | K22: false | L22: false | M22: false | P22: 0 | Q22: 0 | R22: 0 | T22: 4 | U22: -6 | V22: of:=PI() -> 3.14159265358979
A23: running-spit-multi-fireball | B23: running-spit-multi-fireball | C23: Dragontail.Character.Behavior.Player.AttackingStraight | F23: walk | G23: 20 | H23: .attackasefile | I23: spit | J23: 0 | K23: false | L23: false | M23: false | P23: 0 | Q23: 0 | R23: 0 | T23: 8 | U23: 4 | V23: of:=PI() -> 3.14159265358979
A24: fireball-spin-cw | B24: fireball-spin-cw | C24: Dragontail.Character.Behavior.Player.SpinAttack | F24: walk | G24: false | H24: .attackasefile | I24: attackA | J24: 1 | K24: false | L24: false | M24: false | O24: data/sounds/combat/swing2.mp3 | P24: 0 | Q24: 0 | R24: 0 | T24: 1 | U24: 0 | V24: of:=PI()/5 -> 0.628318530717959
A25: fireball-spin-ccw | B25: fireball-spin-ccw | C25: Dragontail.Character.Behavior.Player.SpinAttack | F25: walk | G25: false | H25: .attackasefile | I25: attackB | J25: 1 | K25: false | L25: false | M25: false | O25: data/sounds/combat/swing2.mp3 | P25: 0 | Q25: 0 | R25: 0 | T25: 1 | U25: 0 | V25: of:=PI()/5 -> 0.628318530717959
A26: fireball-storm | B26: fireball-storm | C26: Dragontail.Character.Behavior.Player.SpinAttack | F26: walk | G26: false | H26: .attackasefile | I26: attackA | J26: 1 | K26: false | L26: false | M26: false | O26: data/sounds/player/attacksuper.mp3 | P26: 3 | Q26: 0 | R26: 0 | T26: 8 | U26: 0 | V26: of:=PI()*3/16 -> 0.589048622548086
A27: walk | C27: Dragontail.Character.Behavior.Player.Fighting | F27: walk | G27: false | H27: .mainasefile | I27: Stand | J27: 1 | K27: true | L27: true | M27: false | P27: 0 | Q27: 2 | R27: 2 | T27: 1 | U27: 4 | V27: of:=PI()/8 -> 0.392699081698724
A28: run | B28: running-elbow | C28: Dragontail.Character.Behavior.Player.Running | F28: stopRunning | G28: false | H28: .mainasefile | I28: Walk | J28: 1 | K28: true | L28: true | M28: false | O28: data/sounds/combat/dash.mp3 | P28: 3 | Q28: 2 | R28: 2 | T28: 16 | U28: 8 | V28: of:=PI()/32 -> 0.098174770424681
A29: stopRunning | E29: decelerateXYto0 | F29: walk | G29: 6 | H29: .mainasefile | I29: Stand | J29: 0 | K29: true | L29: true | M29: false | O29: data/sounds/combat/slide.mp3 | P29: 0 | Q29: 2 | R29: 2 | T29: 4 | U29: 4 | V29: 0
A30: hold | D30: hold | F30: walk | G30: false | H30: .holdasefile | I30: hold | J30: 1 | K30: true | L30: true | M30: false | P30: 0 | Q30: 2 | R30: 2 | T30: 1 | U30: 4 | V30: of:=PI()/64 -> 0.0490873852123405
A31: aimThrow | D31: aimThrow | F31: walk | G31: false | H31: .mainasefile | I31: Stand | J31: 0 | K31: true | L31: true | M31: false | P31: 0 | Q31: 2 | R31: 2 | T31: 1 | U31: 4 | V31: of:=PI()/8 -> 0.392699081698724
A32: throwWeapon | D32: throwWeapon | F32: walk | G32: false | H32: .attackasefile | I32: throw | J32: 0 | K32: false | L32: false | M32: false | O32: data/sounds/player/attack2.mp3 | P32: 0 | Q32: 0 | R32: 0 | T32: 1 | U32: 4 | V32: of:=PI() -> 3.14159265358979
A33: spitWeapon | D33: throwWeapon | F33: walk | G33: false | H33: .attackasefile | I33: spit | J33: 0 | K33: false | L33: false | M33: false | O33: data/sounds/player/attack2.mp3 | P33: 0 | Q33: 0 | R33: 0 | T33: 1 | U33: 4 | V33: of:=PI() -> 3.14159265358979
A34: victory | D34: victory | F34: win | G34: false | H34: .mainasefile | I34: win | J34: 1 | K34: false | L34: false | M34: false | O34: data/sounds/player/victory.mp3 | P34: 0 | Q34: 0 | R34: 0 | T34: 1 | U34: 4 | V34: of:=PI() -> 3.14159265358979
A35: hurt | C35: Dragontail.Character.Behavior.Player.TakingHit | F35: walk | G35: false | H35: .mainasefile | I35: Hurt | J35: 0 | K35: false | L35: false | M35: false | O35: data/sounds/player/damage2.mp3 | P35: 0 | Q35: 4 | R35: 1 | T35: 1 | U35: 4 | V35: of:=PI() -> 3.14159265358979
A36: held | C36: Dragontail.Character.Behavior.Player.Held | F36: breakaway | G36: false | H36: .mainasefile | I36: Hurt | J36: 1 | K36: true | L36: false | M36: false | P36: 0 | Q36: 4 | R36: 1 | T36: 1 | U36: 4 | V36: of:=PI() -> 3.14159265358979
A37: knockedBack | D37: knockedBack | F37: fall | G37: 300 | H37: .mainasefile | I37: Hurt | J37: 1 | K37: false | L37: false | M37: true | O37: data/sounds/player/damage3.mp3 | P37: 0 | Q37: 4 | R37: 1 | S37: 0.25 | T37: 1 | U37: 4 | V37: of:=PI() -> 3.14159265358979
A38: knockedBackBurnt | D38: knockedBack | F38: fall | G38: 300 | H38: .mainasefile | I38: Hurt | J38: 1 | K38: false | L38: false | M38: true | N38: of:=ORG.LIBREOFFICE.COLOR(32;32;32;255) -> 4280295456 | O38: data/sounds/player/damage3.mp3 | P38: 0 | Q38: 4 | R38: 1 | S38: 0.25 | T38: 1 | U38: 4 | V38: of:=PI() -> 3.14159265358979
A39: knockedBackBurntJuggled | D39: knockedBack | F39: fall | G39: 300 | H39: .mainasefile | I39: Hurt | J39: 1 | K39: false | L39: false | M39: false | N39: of:=ORG.LIBREOFFICE.COLOR(32;32;32;255) -> 4280295456 | O39: data/sounds/player/damage3.mp3 | P39: 0 | Q39: 4 | R39: 1 | S39: 0.25 | T39: 1 | U39: 4 | V39: of:=PI() -> 3.14159265358979
A40: wallBump | D40: wallBump | F40: fall | G40: 300 | H40: .mainasefile | I40: Hurt | J40: 1 | K40: false | L40: false | M40: true | O40: data/sounds/combat/bodybump.mp3 | P40: 0 | Q40: 4 | R40: 1 | T40: 1 | U40: 4 | V40: of:=PI() -> 3.14159265358979
A41: thrown | B41: human-thrown | D41: thrown | F41: fall | G41: 300 | H41: .mainasefile | I41: spin | J41: 1 | K41: false | L41: false | M41: true | O41: data/sounds/player/damage3.mp3 | P41: 0 | Q41: 4 | R41: 1 | S41: 0.25 | T41: 1 | U41: 4 | V41: of:=PI() -> 3.14159265358979
A42: wallSlammed | D42: wallSlammed | F42: fall | G42: 300 | H42: .mainasefile | I42: Hurt | J42: 1 | K42: false | L42: false | M42: true | O42: data/sounds/combat/bodyslam.mp3 | P42: 0 | Q42: 4 | R42: 1 | T42: 1 | U42: 4 | V42: of:=PI() -> 3.14159265358979
A43: thrownRecover | D43: thrownRecover | F43: walk | G43: false | H43: .mainasefile | I43: FallKnees | J43: 0 | K43: false | L43: false | M43: false | O43: data/sounds/combat/slide.mp3 | P43: 0 | Q43: 4 | R43: 1 | T43: 1 | U43: 4 | V43: of:=PI() -> 3.14159265358979
A44: breakaway | D44: breakaway | F44: walk | G44: 15 | H44: .mainasefile | I44: elbow | J44: 0 | K44: false | L44: false | M44: false | O44: data/sounds/combat/slap.mp3 | P44: 0 | Q44: 4 | R44: 1 | T44: 8 | U44: 4 | V44: of:=PI() -> 3.14159265358979
A45: fall | E45: fall | F45: collapse | G45: 300 | H45: .mainasefile | I45: Hurt | J45: 0 | K45: false | L45: false | M45: true | P45: 0 | Q45: 4 | R45: 1 | S45: 0.25 | T45: 8 | U45: 4 | V45: of:=PI() -> 3.14159265358979
A46: collapse | E46: decelerateXYto0 | F46: down | G46: 15 | H46: .mainasefile | I46: Fall | J46: 0 | K46: false | L46: false | M46: false | P46: 0 | Q46: 4 | R46: 1 | T46: 8 | U46: 4 | V46: of:=PI() -> 3.14159265358979
A47: down | C47: Dragontail.Character.Behavior.Player.Downed | F47: getup | G47: 20 | H47: .mainasefile | I47: Down | J47: 0 | K47: false | L47: false | M47: false | O47: data/sounds/combat/bodydrop.mp3 | P47: 0 | Q47: 4 | R47: 1 | T47: 8 | U47: 4 | V47: of:=PI() -> 3.14159265358979
A48: defeat | D48: defeat | F48: false | G48: false | H48: .mainasefile | I48: Down | J48: 0 | K48: false | L48: false | M48: false | O48: data/sounds/player/defeat.mp3 | P48: 0 | Q48: 4 | R48: 1 | T48: 1 | U48: 4 | V48: of:=PI() -> 3.14159265358979
A49: getup | E49: getup | F49: walk | G49: 18 | H49: .mainasefile | I49: FallRiseToFeet | J49: 0 | K49: false | L49: false | M49: false | N49: of:=ORG.LIBREOFFICE.COLOR(255;255;255;255) -> 4294967295 | O49: data/sounds/player/getup.mp3 | P49: 0 | Q49: 4 | R49: 1 | T49: 1 | U49: 4 | V49: of:=PI() -> 3.14159265358979
A50: sequenceWalkTo | D50: sequenceWalkTo | F50: false | G50: false | H50: .mainasefile | I50: Walk | J50: 1 | K50: false | L50: false | M50: false | P50: 0 | Q50: 0 | R50: 0 | T50: 1 | U50: 4 | V50: of:=PI() -> 3.14159265358979
A51: catchProjectile | C51: Dragontail.Character.Behavior.Fighter.CatchingProjectile | F51: walk | G51: 15 | H51: .mainasefile | I51: catch | J51: 0 | K51: false | L51: false | M51: false | O51: data/sounds/combat/shakiin.mp3 | P51: 0 | Q51: 2 | R51: 1 | T51: 1 | U51: 4 | V51: of:=PI() -> 3.14159265358979
A52: sequenceTailSwing | D52: idle | F52: sequenceWalkTo | G52: 24 | H52: .attackasefile | I52: tailspinCW | J52: 1 | K52: false | L52: false | M52: false | O52: data/sounds/combat/swing2.mp3 | P52: 0 | Q52: 0 | R52: 0 | T52: 1 | U52: 4 | V52: of:=PI() -> 3.14159265358979
A53: jump | C53: Dragontail.Character.Behavior.Player.Jumping | F53: walk | G53: false | H53: .mainasefile | I53: JumpUp | J53: 1 | K53: true | L53: true | M53: false | P53: 0 | Q53: 2 | R53: 2 | T53: 1 | U53: 4 | V53: of:=PI()/8 -> 0.392699081698724
A54: jump-tail-swing-cw | B54: jump-tail-swing-cw | C54: Dragontail.Character.Behavior.Player.SpinAttack | F54: jump | G54: false | H54: .attackasefile | I54: attackA | J54: 1 | K54: true | L54: true | M54: false | O54: data/sounds/combat/swing1a.mp3 | P54: 0 | Q54: 0 | R54: 0 | T54: 0 | U54: false | V54: 0
A55: jump-tail-swing-ccw | B55: jump-tail-swing-ccw | C55: Dragontail.Character.Behavior.Player.SpinAttack | F55: jump | G55: false | H55: .attackasefile | I55: attackA | J55: 1 | K55: true | L55: true | M55: false | O55: data/sounds/combat/swing1a.mp3 | P55: 0 | Q55: 0 | R55: 0 | T55: 0 | U55: false | V55: 0
A56: flyStart | D56: flyStart | F56: walk | G56: false | H56: data/sprites/player/rose/fly.jase | I56: ascend | J56: 1 | K56: false | L56: false | M56: false | N56: of:=ORG.LIBREOFFICE.COLOR(255;255;255;255) -> 4294967295 | O56: data/sounds/player/flyup.mp3 | P56: 3 | Q56: 0 | R56: 0 | T56: 1 | U56: 4 | V56: of:=PI() -> 3.14159265358979
A57: flyEnd | D57: flyEnd | G57: false | H57: data/sprites/player/rose/fly.jase | I57: descend | J57: 1 | K57: false | L57: false | M57: false | P57: 0 | Q57: 0 | R57: 0 | S57: 0.25 | T57: 1 | U57: 4 | V57: of:=PI() -> 3.14159265358979

Sheet: properties
A1: character | B1: name | C1: team | D1: health | E1: manastoremax | F1: bodyradius | G1: bodyheight | H1: bodyinlayers | I1: bodyhitslayers | J1: speed | K1: gravity | L1: projectilelaunchheight | M1: aiafterthrown | N1: asetag | O1: animationdirections | P1: script | Q1: statetable | R1: attacktable | S1: aiafterhurt | T1: wallslamdamage | U1: thrownrecoveranimation | V1: defeatai | W1: recoverai | X1: pickupradius | Y1: canfly | Z1: asefile | AA1: mainasefile | AB1: attackasefile | AC1: holdasefile | AD1: faceasepritefile | AE1: shadowcolor | AF1: weaponposasefile | AG1: holdsound | AH1: throwsound | AI1: stopdashsound | AJ1: jumplandsound | AK1: chargesound1 | AL1: chargesound2 | AM1: chargesound3
A2: Rose | B2: Rose | C2: player | D2: 100 | E2: 180 | F2: 12 | G2: 32 | H2: Player | I2: Object Wall Camera | J2: 4 | K2: 0.25 | L2: 16 | M2: fall | N2: Stand0 | O2: 8 | P2: Dragontail.Character.Player | Q2: data/database/players-states.csv | R2: data/database/players-attacks.csv | S2: walk | T2: 10 | U2: FallRiseToFeet | V2: defeat | W2: walk | X2: 20 | Y2: false | Z2: data/sprites/player/rose/main.jase | AA2: data/sprites/player/rose/main.jase | AB2: data/sprites/player/rose/attack.jase | AC2: data/sprites/player/rose/hold.jase | AD2: data/sprites/player/rose/face.jase | AE2: of:=ORG.LIBREOFFICE.COLOR(0;0;0;255) -> 4278190080 | AF2: data/sprites/player/rose/main-weapon.jase | AG2: data/sounds/combat/grab.mp3 | AH2: data/sounds/player/attack2.mp3 | AI2: data/sounds/combat/slide.mp3 | AJ2: data/sounds/combat/landonfeet.mp3 | AK2: data/sounds/player/chargefull1.mp3 | AL2: data/sounds/player/chargefull2.mp3 | AM2: data/sounds/player/chargefull3.mp3
A3: RoseWinged | B3: Rose | C3: player | D3: 150 | E3: 240 | F3: 12 | G3: 32 | H3: Player | I3: Object Wall Camera | J3: 4 | K3: 0.25 | L3: 16 | M3: fall | N3: Stand0 | O3: 8 | P3: Dragontail.Character.Player | Q3: data/database/players-states.csv | R3: data/database/players-attacks.csv | S3: walk | T3: 10 | U3: FallRiseToFeet | V3: defeat | W3: walk | X3: 20 | Y3: true | Z3: data/sprites/player/rose/winged-main.jase | AA3: data/sprites/player/rose/winged-main.jase | AB3: data/sprites/player/rose/winged-attack.jase | AC3: data/sprites/player/rose/winged-hold.jase | AD3: data/sprites/player/rose/face.jase | AE3: of:=ORG.LIBREOFFICE.COLOR(0;0;0;255) -> 4278190080 | AF3: data/sprites/player/rose/main-weapon.jase | AG3: data/sounds/combat/grab.mp3 | AH3: data/sounds/player/attack2.mp3 | AI3: data/sounds/combat/slide.mp3 | AJ3: data/sounds/combat/landonfeet.mp3 | AK3: data/sounds/player/chargefull1.mp3 | AL3: data/sounds/player/chargefull2.mp3 | AM3: data/sounds/player/chargefull3.mp3