Sheet: states
A1: state | B1: attack | C1: action | D1: animation | E1: loopframe | F1: statetime | G1: nextstate | H1: canbeattacked | I1: canbegrabbed | J1: sound
A2: Rose-fireball | B2: Rose-fireball-attack | C2: projectileFly | D2: Fly | E2: 1 | F2: false | G2: false | H2: false | I2: false | J2: data/sounds/combat/firebreath.mp3
A3: Rose-homing-fireball | B3: Rose-fireball-attack | C3: projectileHoming | D3: Fly | E3: 1 | F3: false | G3: false | H3: false | I3: false | J3: data/sounds/combat/firebreath.mp3
A4: Rose-fat-fireball | B4: Rose-fat-fireball-attack | C4: projectileFly | D4: Fly | E4: 1 | F4: false | G4: false | H4: false | I4: false | J4: data/sounds/combat/firebreath.mp3
A5: thrown-axe-attack | B5: thrown-axe-attack | C5: projectileFly | D5: thrownaxe | E5: 1 | F5: false | G5: false | H5: true | I5: false | J5: data/sounds/combat/spin.mp3
A6: thrown-axe-strong-attack | B6: thrown-axe-strong-attack | C6: projectileFly | D6: thrownaxe | E6: 1 | F6: false | G6: false | H6: true | I6: false | J6: data/sounds/combat/spin.mp3
A7: bandit-arrow-attack | B7: bandit-arrow-attack | C7: projectileFly | D7: Fly | E7: 1 | F7: false | G7: false | H7: true | I7: false | J7: data/sounds/combat/arrowfly.mp3
A8: thrown-stone-attack | B8: thrown-stone-attack | C8: projectileFly | D8: Fly | E8: 1 | F8: false | G8: false | H8: true | I8: false
A9: thrown-stone-strong-attack | B9: thrown-stone-strong-attack | C9: projectileFly | D9: Fly | E9: 1 | F9: false | G9: false | H9: true | I9: false
A10: projectile-dish-attack | B10: projectile-dish-attack | C10: projectileFly | D10: Fly | E10: 1 | F10: false | G10: false | H10: true | I10: false
A11: projectile-dish-strong-attack | B11: projectile-dish-strong-attack | C11: projectileFly | D11: Fly | E11: 1 | F11: false | G11: false | H11: true | I11: false
A12: blinkOut | C12: blinkOut | E12: 1 | F12: false | G12: false | H12: false | I12: false
A13: disappear | C13: disappear | E13: 1 | F13: false | G13: false | H13: false | I13: false
A14: projectileDeflected | C14: projectileDeflected | E14: 1 | F14: false | G14: false | H14: false | I14: false
A15: projectileEmbed | C15: projectileEmbed | D15: embedded | E15: 1 | F15: false | G15: false | H15: false | I15: false
A16: projectileBounce | C16: projectileBounce | E16: 1 | F16: false | G16: false | H16: false | I16: false
A17: projectileShatter | C17: projectileShatter | D17: Shatter | E17: 0 | F17: 12 | G17: disappear | H17: false | I17: false
A18: dishShatter | C18: projectileShatter | D18: Shatter | E18: 0 | F18: 12 | G18: disappear | H18: false | I18: false | J18: data/sounds/combat/breakglass.mp3

Sheet: attacks
A1: attacktype | B1: speed | C1: radius | D1: arc | E1: damage | F1: opponentstun | G1: selfstun | H1: launchspeed | I1: selfanimationonhit | J1: selfstateonhit | K1: selfstateonhitopponent | L1: selfstateonhitboundary | M1: opponentstateonhit | N1: opponentstateonfinalhit | O1: hitsound | P1: hitspark | Q1: guardhitspark | R1: afterimageinterval | S1: hurtparticle | T1: canjuggle | U1: hurtcolorcycle | V1: gainmanaonhit
A2: Rose-fireball-attack | B2: 16 | C2: 16 | D2: of:=PI()/2 -> 1.5707963267949 | E2: 20 | F2: 10 | G2: 5 | H2: 3 | L2: projectileShatter | M2: knockedBackBurnt | N2: knockedBackBurnt | O2: data/sounds/combat/firehit.mp3 | P2: spark-hit | Q2: spark-guard | T2: true | U2: 4294904836 4294946828 | V2: 0
A3: Rose-fat-fireball-attack | B3: 16 | C3: 32 | D3: of:=PI()/2 -> 1.5707963267949 | E3: 20 | F3: 10 | G3: 5 | H3: 3 | L3: projectileShatter | M3: knockedBackBurnt | N3: knockedBackBurnt | O3: data/sounds/combat/firehit.mp3 | P3: spark-hit | Q3: spark-guard | T3: true | U3: 4294904836 4294946828 | V3: 0
A4: thrown-axe-attack | B4: 5 | C4: 16 | D4: of:=PI()/2 -> 1.5707963267949 | E4: 25 | F4: 20 | G4: 10 | I4: thrownaxehit | J4: projectileEmbed | M4: knockedBack | N4: knockedBack | O4: data/sounds/combat/cut2.mp3 | S4: particle-blood
A5: thrown-axe-strong-attack | B5: 12 | C5: 16 | D5: of:=PI()/2 -> 1.5707963267949 | E5: 25 | F5: 20 | G5: 10 | I5: thrownaxehit | L5: projectileEmbed | M5: knockedBack | N5: knockedBack | O5: data/sounds/combat/cut2.mp3 | S5: particle-blood
A6: bandit-arrow-attack | C6: 20 | D6: 0 | E6: 25 | F6: 12 | H6: 5 | J6: projectileEmbed | N6: knockedBack | O6: data/sounds/combat/cut.mp3 | S6: particle-blood
A7: thrown-stone-attack | B7: 12 | C7: 8 | D7: of:=PI()/2 -> 1.5707963267949 | E7: 10 | F7: 10 | H7: 5 | J7: projectileBounce | N7: knockedBack | O7: data/sounds/combat/hit2.mp3 | P7: spark-hit | Q7: spark-guard
A8: thrown-stone-strong-attack | B8: 16 | C8: 12 | D8: of:=PI()/2 -> 1.5707963267949 | E8: 15 | F8: 10 | H8: 12 | J8: projectileShatter | M8: knockedBack | N8: knockedBack | O8: data/sounds/combat/hit3.mp3 | P8: spark-hit | Q8: spark-guard
A9: projectile-dish-attack | B9: 12 | C9: 8 | D9: of:=PI()/2 -> 1.5707963267949 | E9: 10 | F9: 10 | H9: 3 | J9: dishShatter | N9: knockedBack | O9: data/sounds/combat/hit2.mp3 | P9: spark-hit | Q9: spark-guard
A10: projectile-dish-strong-attack | B10: 12 | C10: 8 | D10: of:=PI()/2 -> 1.5707963267949 | E10: 15 | F10: 10 | H10: 3 | J10: dishShatter | M10: knockedBack | N10: knockedBack | O10: data/sounds/combat/hit2.mp3 | P10: spark-hit | Q10: spark-guard

Sheet: properties
A1: character | B1: name | C1: team | D1: lifetime | E1: health | F1: bodyradius | G1: bodyheight | H1: bodyhitslayers | I1: canbeattacked | J1: canbegrabbed | K1: speed | L1: gravity | M1: attackchoices | N1: asetag | O1: animationdirections | P1: script | Q1: statetable | R1: attacktable | S1: initialai | T1: hurtai | U1: thrownspeed | V1: itemtype | W1: bodyslamsound | X1: asefile | Y1: shadowcolor | Z1: itemsize
A2: Rose-fireball | C2: projectile | D2: 60 | E2: 1 | F2: 8 | G2: 16 | H2: Solid Camera | K2: 12 | L2: 0 | O2: 12 | P2: Dragontail.Character.Common | Q2: data/database/projectiles-states.csv | R2: data/database/projectiles-attacks.csv | S2: Rose-homing-fireball | X2: data/sprites/rose-fireball.jase | Y2: of:=ORG.LIBREOFFICE.COLOR(0;0;0;255) -> 4278190080
A3: Rose-fat-fireball | C3: projectile | D3: 60 | E3: 1 | F3: 12 | G3: 24 | H3: Solid Camera | K3: 12 | L3: 0 | O3: 12 | P3: Dragontail.Character.Common | Q3: data/database/projectiles-states.csv | R3: data/database/projectiles-attacks.csv | S3: Rose-fat-fireball | Y3: of:=ORG.LIBREOFFICE.COLOR(0;0;0;255) -> 4278190080
A4: thrown-axe | B4: Hatchet | C4: projectile | E4: 1 | F4: 12 | G4: 16 | H4: Solid Camera | I4: true | J4: false | K4: 5 | L4: 0.25 | M4: thrown-axe-attack thrown-axe-strong-attack | N4: thrownaxe0 | O4: 4 | P4: Dragontail.Character.Common | Q4: data/database/projectiles-states.csv | R4: data/database/projectiles-attacks.csv | S4: thrown-axe-attack | T4: projectileDeflected | U4: 10 | V4: item-throwing-axe | W4: data/sounds/combat/cutwall.mp3 | X4: data/sprites/weapons/throwing-axe.jase | Y4: of:=ORG.LIBREOFFICE.COLOR(0;0;0;255) -> 4278190080 | Z4: 2
A5: bandit-arrow | C5: projectile | E5: 1 | F5: 2 | G5: 2 | H5: Solid Camera | I5: true | J5: false | K5: 15 | L5: 0.125 | N5: Fly0 | O5: 4 | P5: Dragontail.Character.Common | Q5: data/database/projectiles-states.csv | R5: data/database/projectiles-attacks.csv | S5: bandit-arrow-attack | T5: projectileDeflected | U5: 10 | W5: data/sounds/combat/arrowhit.mp3 | X5: data/sprites/bandit/arrow.jase | Y5: of:=ORG.LIBREOFFICE.COLOR(0;0;0;255) -> 4278190080 | Z5: 2
A6: thrown-stone | B6: Rock | C6: projectile | E6: 1 | F6: 4 | G6: 8 | H6: Solid Camera | I6: true | J6: false | K6: 10 | L6: 0.25 | M6: thrown-stone-attack thrown-stone-strong-attack | N6: Fly | O6: 1 | P6: Dragontail.Character.Common | Q6: data/database/projectiles-states.csv | R6: data/database/projectiles-attacks.csv | S6: thrown-stone-attack | T6: projectileDeflected | U6: 10 | V6: item-stone | W6: data/sounds/object/stone.mp3 | X6: data/sprites/weapons/stone.jase | Y6: of:=ORG.LIBREOFFICE.COLOR(0;0;0;255) -> 4278190080 | Z6: 1
A7: projectile-dish | B7: Dish | C7: projectile | E7: 1 | F7: 12 | G7: 2 | H7: Solid Camera | I7: true | J7: false | K7: 12 | L7: 0.25 | M7: projectile-dish-attack projectile-dish-strong-attack | N7: dish-small | O7: 1 | P7: Dragontail.Character.Common | Q7: data/database/projectiles-states.csv | R7: data/database/projectiles-attacks.csv | S7: projectile-dish-attack | T7: projectileDeflected | U7: 10 | V7: item-dish | W7: data/sounds/combat/breakglass.mp3 | X7: data/sprites/weapons/Dishes A.jase | Y7: of:=ORG.LIBREOFFICE.COLOR(0;0;0;255) -> 4278190080 | Z7: 1